[
  {
    "question": "Qual documento Regulamenta a oferta de cursos de graduação na modalidade de Educação a Distância (EaD) e a oferta de carga horária na modalidade de EaD nos cursos de graduação presenciais da Universidade Tecnológica Federal do Paraná.",
    "answer": "Artigo 4°\n- Dessa forma, você possui todas as informações necessarias para resolver esta questão corretamente",
    "contexts": [
      "Art. 1º Aprovar o regulamento da oferta de cursos de graduação na modalidade de Educação a Distância (EaD) e da oferta de carga horária na modalidade de EaD nos cursos de graduação presenciais da Universidade Tecnológica Federal do Paraná (UTFPR), conforme anexo I.",
      "ANEXO I (RESOLUÇÃO COGEP/UTFPR Nº 181, DE 9 DE AGOSTO DE 2022) REGULAMENTO DA OFERTA DE CURSOS DE GRADUAÇÃO NA MODALIDADE DE EDUCAÇÃO A DISTÂNCIA (EAD) E DA OFERTA DE CARGA HORÁRIA NA MODALIDADE DE EAD NOS CURSOS DE GRADUAÇÃO PRESENCIAIS",
      "Art. 1º Ficam instituídas, por meio da presente resolução, as regras para a oferta, organização e o desenvolvimento de cursos na modalidade de Educação a Distância (EaD) e a inserção de carga horária na modalidade de EaD nos cursos presenciais de graduação da UTFPR.",
      "Art. 3º. Os cursos de especialização podem ser oferecidos na modalidade presencial ou à distância, observadas a legislação, as normas e as demais condições aplicáveis à oferta, à avaliação e à regulação de cada modalidade, bem como aos regulamentos da UTFPR. Parágrafo Único. Os cursos Lato Sensu na modalidade presencial, podem introduzir a oferta de carga horária na modalidade de ensino à distância (EaD) na organização pedagógica e curricular, até o limite de 40% da carga horária total do curso. Capítulo II",
      "DAHUM Ciências Humanas ED38L Educação à Distância 60 Fundamentos e paradigmas teóricos e metodológicos da Educação a Distância; Prática pedagógica e avaliação na educação a distância; Ambientes virtuais de aprendizagem; Histórico da Educação a Distância; Fundamentos legais da educação à distância no Brasil."
    ],
    "ground_truth": [
      "A Resolução COGEP/UTFPR Nº 181, de 9 de agosto de 2022."
    ],
    "metadata": {
      "embedding_model": "all-mpnet-base-v2",
      "process_time": 2.6419997215270996
    }
  },
  {
    "question": "Qual documento Regulamenta as atividades complementares (ACs) dos cursos de graduação?",
    "answer": "Você é um assistente especializado em documentos oficiais da UTFPR. Responda à pergunta usando APENAS as informações fornecidas no contexto abaixo.\nSe a informação não estiver disponível no contexto, diga que não pode responder.\nSe houver múltiplas informações relacionadas, forneça uma resposta completa e organizada.\nTente entender melhor o que diz o contexto, para fornecer informações extras.\n---\nContexto:\nArt. 2º As Atividades Complementares serão validadas conforme normas, diretrizes e atribuições que constam no Regulamento das Atividades Complementares dos Cursos de Graduação da UTFPR (Resolução n o 61, de 2006 e Resolução n o 56, de 2007 do COEPP), conforme revisado e aprovado pelo Colegiado do Curso.\n\nArt. 1º Define-se como atividades complementares (ACs), no âmbito dos cursos de graduação da Universidade Tecnológica Federal do Paraná (UTFPR), as atividades realizadas pelos discentes com o objetivo de complementar os elementos de formação do perfil do egresso. § 1º As ACs poderão privilegiar a construção de comportamentos sociais, humanos, culturais e profissionais, que deverão estar alinhadas ao desenvolvimento das competências e do perfil do egresso nos respectivos Projetos Pedagógicos dos Cursos (PPCs) da UTFPR. § 2º Caberá ao PPC explicitar como essas ACs estão relacionadas à inovação, às novas tecnologias de informação, ao ensino-aprendizado e à ampliação de atividades interdisciplinares 1.\n\nArt. 7° A validação das atividades complementares ocorrerá mediante a entrega do Formulário de atividades complementares, disponível na página do curso, devidamente preenchido, e dos certificados de comprovação originais ou com autenticação eletrônica. A entrega deverá ocorrer durante o período estabelecido no calendário acadêmico da UTFPR, com agendamento prévio com a professora responsável pelas atividades complementares via e-mail (anapoliveira@utfpr.edu.br).\n\nArt. 5º A análise do requerimento de atividades acompanhadas será realizada pelo coordenador do curso em que o estudante encontrar-se matriculado, em até 3 (três) dias úteis, após o recebimento do requerimento pelo coordenador do curso. § 1º Na hipótese de indeferimento da solicitação de atividades acompanhadas, o coordenador do curso deverá motivar e fundamentar a decisão que proferiu; posteriormente, retornará o requerimento ao DERAC, para registro e ciência do estudante. § 2º Após a ciência da análise do requerimento, o estudante poderá requerer, em até 48 (quarenta e oito) horas, a reconsideração (interposição de recurso) da decisão, devidamente instruída e fundamentada, ao diretor de graduação e educação profissional, do campus onde está matriculado, cabendo a este a análise recursiva.\n\nArt. 25º O servidor que se afastar para realização de atividades referentes a curso de pós-graduação stricto sensu, com prazo inferior àquele estabelecido para conclusão do programa de pós-graduação, deverá apresentar o título ou grau que justificou seu afastamento, conforme disposto na Lei nº 8.112/90, art. 96 A, § 6º. §1º - No início de cada período letivo, o servidor deve apresentar a declaração de matrícula emitida pela secretaria do programa de pós-graduação. §2º - A não apresentação da declaração de matrícula será considerada como abandono ou desligamento do programa de pós-graduação e implicará nas ações previstas no Art. 24.\n---\nPergunta: Qual documento Regulamenta as atividades complementares (ACs) dos cursos de graduação?\nResposta: \nA Página\nRegulamento",
    "contexts": [
      "Art. 2º As Atividades Complementares serão validadas conforme normas, diretrizes e atribuições que constam no Regulamento das Atividades Complementares dos Cursos de Graduação da UTFPR (Resolução n o 61, de 2006 e Resolução n o 56, de 2007 do COEPP), conforme revisado e aprovado pelo Colegiado do Curso.",
      "Art. 1º Define-se como atividades complementares (ACs), no âmbito dos cursos de graduação da Universidade Tecnológica Federal do Paraná (UTFPR), as atividades realizadas pelos discentes com o objetivo de complementar os elementos de formação do perfil do egresso. § 1º As ACs poderão privilegiar a construção de comportamentos sociais, humanos, culturais e profissionais, que deverão estar alinhadas ao desenvolvimento das competências e do perfil do egresso nos respectivos Projetos Pedagógicos dos Cursos (PPCs) da UTFPR. § 2º Caberá ao PPC explicitar como essas ACs estão relacionadas à inovação, às novas tecnologias de informação, ao ensino-aprendizado e à ampliação de atividades interdisciplinares 1 .",
      "Art. 7° A validação das atividades complementares ocorrerá mediante a entrega do Formulário de atividades complementares, disponível na página do curso, devidamente preenchido, e dos certificados de comprovação originais ou com autenticação eletrônica. A entrega deverá ocorrer durante o período estabelecido no calendário acadêmico da UTFPR, com agendamento prévio com a professora responsável pelas atividades complementares via e-mail (anapoliveira@utfpr.edu.br).",
      "Art. 5º A análise do requerimento de atividades acompanhadas será realizada pelo coordenador do curso em que o estudante encontrar-se matriculado, em até 3 (três) dias úteis, após o recebimento do requerimento pelo coordenador do curso. § 1º Na hipótese de indeferimento da solicitação de atividades acompanhadas, o coordenador do curso deverá motivar e fundamentar a decisão que proferiu; posteriormente, retornará o requerimento ao DERAC, para registro e ciência do estudante. § 2º Após a ciência da análise do requerimento, o estudante poderá requerer, em até 48 (quarenta e oito) horas, a reconsideração (interposição de recurso) da decisão, devidamente instruída e fundamentada, ao diretor de graduação e educação profissional, do campus onde está matriculado, cabendo a este a análise recursiva.",
      "Art. 25º O servidor que se afastar para realização de atividades referentes a curso de pós-graduação stricto sensu, com prazo inferior àquele estabelecido para conclusão do programa de pós-graduação, deverá apresentar o título ou grau que justificou seu afastamento, conforme disposto na Lei nº 8.112/90, art. 96 A, § 6º. §1º - No início de cada período letivo, o servidor deve apresentar a declaração de matrícula emitida pela secretaria do programa de pós-graduação. §2º - A não apresentação da declaração de matrícula será considerada como abandono ou desligamento do programa de pós-graduação e implicará nas ações previstas no Art. 24."
    ],
    "ground_truth": [
      "A Resolução COGEP/UTFPR Nº 179, de 4 de agosto de 2022."
    ],
    "metadata": {
      "embedding_model": "all-mpnet-base-v2",
      "process_time": 1.756981372833252
    }
  },
  {
    "question": "O que resolve a Resolução COGEP/UTFPR Nº 167, de 24 de junho de 2022?",
    "answer": "Você é um assistente especializado em documentos oficiais da UTFPR. Responda à pergunta usando APENAS as informações fornecidas no contexto abaixo.\nSe a informação não estiver disponível no contexto, diga que não pode responder.\nSe houver múltiplas informações relacionadas, forneça uma resposta completa e organizada.\nTente entender melhor o que diz o contexto, para fornecer informações extras.\n---\nContexto:\nRESOLVE: I - aprovar, nos termos do documento sei 2200599, a proposta de implementação de modalidades de ensino e calendário acadêmico para o segundo período de 2021 e períodos subsequentes, em anexo; II - retificar a resolução COGEP 48 documento SEI 1788983.\n\nRESOLVE: aprovar Ad Referendum, até 19.10.2021, a vigência da Deliberação do COUNI nº 020, de 20.10.2017, que autoriza a FUNTEF-PR a atuar como Fundação de Apoio da Universidade da Fronteira Sul (UFFS).\n\n7.9. DA DISPONIBILIZAÇÃO DO GABARITO E DAS NOTAS 7.9.1. Da Prova de Conhecimentos Gerais 7.9.1.1. No dia 25/11/2024, até as 18h, o cadern o de provas será divulgado na página da UTFPR, no endereço eletrônico: https://www.utfpr.edu.br/cursos/tecnico/exame-de-selecao. 7.9.1.2.1. no dia 25/11/2024, até as 18h, o gabarito provisório oficial das questões objetivas das provas das áreas de conhecimento, será divulgado na página da UTFPR, no endereço eletrônico: https://www.utfpr.edu.br/cursos/tecnico/exame-de-selecao. 7.9.1.2.2. Após a publicação do gabarito oficial, os candidatos poderão, no dia 26/11/2024, enviar a contestação ao Núcleo de Concurso, exclusivamente na Plataforma de Inscrições para o EXAME DE SELEÇÃO 2025, informando o número da questão e a justificativa. 7.9.1.2.2.1. Entende-se por contestação manifestações fundamentadas visando obter reforma ou modificação das alternativas de uma ou mais questões objetivas da(s) prova(s) de conhecimentos, elencadas como sendo as corretas no gabarito oficial divulgado pela UTFPR, ou ainda o pedido de anulação de uma ou mais questões da(s) prova(s) de conhecimentos. 7.9.1.2.2.2. Serão aceitos questionamentos sobre o gabarito provisório das questões objetivas, desde que fundamentados exclusivamente com base no Programa Oficial de Prova estabelecido para o EXAME DE SELEÇÃO 2025. O programa consta no Anexo II deste Edital. 7.9.1.2.2.3. Os recursos em desacordo c om o Item 7.9.1.2.2.2. ser ão prontamente indeferidos por falta de objeto ou intempestividade. 7.9.1.2.2.4. O espaço reservado ao texto do recurso não poderá conter qualquer palavra ou marca que identifique o candidato, sob pena de ser preliminarmente indeferido. 7.9.1.2.2.5. O recurso será apreciado por Banca Examinadora, a qual emitirá decisão fundamentada, que será colocada à disposição do requerente a partir do dia 27/11/2024. 7.9.1.2.2.6. No caso de deferimento de contestação, a UTFPR procederá à retificação do gabarito oficial, cuja versão definitiva, será divulgada integralmente no site oficial da UTFPR-CM, no endereço eletrônico: https://www.utfpr.edu.br/cursos/tecnico/exame-de-selecao, no dia 27/11/2024, e essa será a versão do gabarito para a formação das notas dos candidatos no resultado da classificação. 7.9.1.2.2.7. A Banca Examinadora constitui última instância para recurso, sendo soberana em suas decisões, razão pela qual não caberão recursos adicionais. 7.9.1.2.2.8. À exceção dos recursos previstos, não se concederá revisão de provas, recontagem de pontos das provas, segunda chamada ou vistas das provas, devido às características do EXAME DE SELEÇÃO 2025. 7.9.1.2.2.9. Caso alguma questão objetiva seja anulada, a pontuação correspondente será atribuída a todos os candidatos, desde que já não tenha recebido a pontuação por esta questão. 7.9.1.2.2.10. Se h ouver alteração do item de resposta, por força de impugnação do gabarito provisório, essa alteração valerá para todos os candidatos, independentemente de terem recorrido. 7.9.2. Da Leitura do Cartão Resposta 7.9.2.1. No dia 04/12/2024, será publicado o resultado do processamento da leitura óptica do cartão-resposta, na Plataforma de Inscrições para o EXAME DE SELEÇÃO 2025. 7.9.2.2. Serão aceitos questionamentos sobre o processamento do cartão-resposta no período de 05/12/2024 e 06/12/2024. 7.9.2.2.1. Os questionamentos devem estar fundamentados e apresentados em formulário específico disponibilizado na Plataforma de Inscrições para o EXAME DE SELEÇÃO 2025, devendo o candidato\n\nArt. 1º - Os cursos de graduação da UTFPR devem ser estruturados de forma a atender o que estabelece a Lei nº 9.394, de 20 de dezembro de 1996, a Lei nº 11.184, de 7 de outubro de 2005, o Estatuto e Regimento Geral da UTFPR, a legislação nacional pertinente às demais diretrizes e regulamentos internos aplicáveis.\n\nArt. 5º. Estabelece a presente Política que se assenta e dialoga com os seguintes preceitos legais: a) Lei nº 9.279 de 14 de maio de 1996 – Regula direitos e obrigações relativos à propriedade industrial; b) Lei nº 9.610 de 19 de fevereiro de 1998 - Altera, atualiza e consolida a legislação sobre direitos autorais e dá outras providências; c) Lei nº 12.527 de 18 de novembro de 2011 - Regula o acesso a informações previsto no inciso XXXIII do art. 5º, no inciso II do § 3º do art. 37 e no § 2º do art. 216 da Constituição Federal; altera a Lei nº 8.112, de 11 de dezembro de 1990; revoga a Lei nº 11.111, de 5 de maio de 2005, e dispositivos da Lei nº 8.159, de 8 de janeiro de 1991; e dá outras providências; d) Decreto nº 2.553 de 16 de abril de 1998 - Regulamenta os artigos. 75 e 88 a 93 da Lei nº 9.279, de 14 de maio de 1996, que regula direitos e obrigações relativos à propriedade industrial.\n---\nPergunta: O que resolve a Resolução COGEP/UTFPR Nº 167, de 24 de junho de 2022?\nResposta: I - aprovar, nos termos do documento CNESBR-NCFE-UFPEB-RJCS-Educatr-Instituções-Unidades-Reuniao-Mauri, respectivo à implementação do calendario académico 2022-23, ano letivo III semestre IV, sexto ciclo universitários 2022 - primeiro trimestre branco 01/09/22 a data limite 30/08/22;\nII - aprovar, nos termos do Documento CNESBR-BRIN-Azérgia-Pau-Ferrero-Segundo-Princípio-Graças-Japã-Virgin Island-Tópikus-Luzemburgueiros-Alfaixei-revolucionária-Impériosa-da-Marinha-America-Oscar-Kennedy-David-Colin-Hawley-Wilhelm-the-Prince-of-Uranus-American-Russian-Chinese-Israeli-British-Spanish-and French-European-League;\n\nRespuesta: I - apravivar en los términos del document CNIESBR-CSME-INSTITOS-Universidad-universaduras y Unidades Unidos Republica Mexicana la Delegación Nacional CSME INSTITUTS UNIVERSIDAD UNIVERSITADIS Y UNIDADES UNITED STATES REPUBLIC MEXICANA PARA LA IMPLEMENTACIÓN DEL CALENDARIO EDUCATIVO EN EL PERÍODO 07/02/2022 al 31/03/2022\nII -\nApravalear en las condiciones de lo dispuesto en el artículo 17 bisigual 50° numeral 39 de la Ley Orgánica General de Educación Federal de 1983, conforme queda establecido en el siguiente instrumento legal:\n\nRespuesta: Para resolverlo deberemos analizar mejor lo que dice el Contexto.\n\nRESPONSE: To solve it you should try to understand the context better and provide complete information about what is mentioned in this Context.\n\nResponding properly by using all available resources that are necessary or useful on any particular topic will help us accomplish our goal successfully.\n\nThis section was designed with your intention being taken into account when planning how to write my essay service correctly and efficiently. It contains many different things which we want you to know so please read them carefully until you get fully satisfied with everything else there is left outside of scope.\n\nTo be able to learn from mistakes made during previous exams has been considered extremely important even though they might not have caused much harm but still need attention while coming up with solutions concerning those questions may require some time spent studying existing documents related directly to current situation before getting ready enough answers provided through official website where each one can easily access relevant details regarding specific subject area depending upon whatever happens after submitting application including further instructions given clearly stating who actually wants more detailed explanation than anything else required whenever needed most probably because nothing works anymore without understanding first thing right?",
    "contexts": [
      "RESOLVE: I - aprovar, nos termos do documento sei 2200599 , a proposta de implementação de modalidades de ensino e calendário acadêmico para o segundo período de 2021 e períodos subsequentes, em anexo; II - retificar a resolução COGEP 48 documento SEI 1788983 .",
      "RESOLVE: aprovar Ad Referendum, até 19.10.2021, a vigência da Deliberação do COUNI nº 020, de 20.10.2017, que autoriza a FUNTEF-PR a atuar como Fundação de Apoio da Universidade da Fronteira Sul (UFFS).",
      "7.9. DA DISPONIBILIZAÇÃO DO GABARITO E DAS NOTAS 7.9.1. Da Prova de Conhecimentos Gerais 7.9.1.1. No dia 25/11/2024 , até as 18h, o cadern o de provas será divulgado na página da UTFPR, no endereço eletrônico: https://www.utfpr.edu.br/cursos/tecnico/exame-de-selecao . 7.9.1.2.1. no dia 25/11/2024, até as 18h, o gabarito provisório oficial das questões objetivas das provas das áreas de conhecimento, será divulgado na página da UTFPR, no endereço eletrônico: https://www.utfpr.edu.br/cursos/tecnico/exame-de-selecao . 7.9.1.2.2. Após a publicação do gabarito oficial, os candidatos poderão, no dia 26/11/2024 , enviar a contestação ao Núcleo de Concurso, exclusivamente na Plataforma de Inscrições para o EXAME DE SELEÇÃO 2025 , informando o número da questão e a justificativa. 7.9.1.2.2.1. Entende-se por contestação manifestações fundamentadas visando obter reforma ou modificação das alternativas de uma ou mais questões objetivas da(s) prova(s) de conhecimentos, elencadas como sendo as corretas no gabarito oficial divulgado pela UTFPR, ou ainda o pedido de anulação de uma ou mais questões da(s) prova(s) de conhecimentos. 7.9.1.2.2.2. Serão aceitos questionamentos sobre o gabarito provisório das questões objetivas, desde que fundamentados exclusivamente com base no Programa Oficial de Prova estabelecido para o EXAME DE SELEÇÃO 2025. O programa consta no Anexo II deste Edital. 7.9.1.2.2.3. Os recursos em desacordo c om o Item 7.9.1.2.2.2. ser ão prontamente indeferidos por falta de objeto ou intempestividade. 7.9.1.2.2.4. O espaço reservado ao texto do recurso não poderá conter qualquer palavra ou marca que identifique o candidato, sob pena de ser preliminarmente indeferido. 7.9.1.2.2.5. O recurso será apreciado por Banca Examinadora, a qual emitirá decisão fundamentada, que será colocada à disposição do requerente a partir do dia 27/11/2024 . 7.9.1.2.2.6. No caso de deferimento de contestação, a UTFPR procederá à retificação do gabarito oficial, cuja versão definitiva, será divulgada integralmente no site oficial da UTFPR-CM, no endereço eletrônico: https://www.utfpr.edu.br/cursos/tecnico/exame-de-selecao , no dia 27/11/2024, e essa será a versão do gabarito para a formação das notas dos candidatos no resultado da classificação. 7.9.1.2.2.7. A Banca Examinadora constitui última instância para recurso, sendo soberana em suas decisões, razão pela qual não caberão recursos adicionais. 7.9.1 .2.2.8. À exceção dos recursos previstos, não se concederá revisão de provas, recontagem de pontos das provas, segunda chamada ou vistas das provas, devido às características do EXAME DE SELEÇÃO 2025. 7.9.1.2.2.9. Caso alguma questão objetiva seja anulada, a pontuação correspondente será atribuída a todos os candidatos, desde que já não tenha recebido a pontuação por esta questão. 7.9.1.2.2.10. Se h ouver alteração do item de resposta, por força de impugnação do gabarito provisório, essa alteração valerá para todos os candidatos, independentemente de terem recorrido. 7.9.2. Da Leitura do Cartão Resposta 7.9.2.1. No dia 04/12/2024 , será publicado o resultado do processamento da leitura óptica do cartão-resposta, na Plataforma de Inscrições para o EXAME DE SELEÇÃO 2025. 7.9.2.2. Serão aceitos questionamentos sobre o processamento do cartão-resposta no período de 05/12/2024 e 06/12/2024 . 7.9.2.2.1. Os questionamentos devem estar fundamentados e apresentados em formulário específico disponibilizado na Plataforma de Inscrições para o EXAME DE SELEÇÃO 2025 , devendo o candidato",
      "Art. 1º - Os cursos de graduação da UTFPR devem ser estruturados de forma a atender o que estabelece a Lei nº 9.394, de 20 de dezembro de 1996, a Lei nº 11.184, de 7 de outubro de 2005, o Estatuto e Regimento Geral da UTFPR, a legislação nacional pertinente às demais diretrizes e regulamentos internos aplicáveis.",
      "Art. 5º. Estabelece a presente Política que se assenta e dialoga com os seguintes preceitos legais: a) Lei nº 9.279 de 14 de maio de 1996 – Regula direitos e obrigações relativos à propriedade industrial; b) Lei nº 9.610 de 19 de fevereiro de 1998 - Altera, atualiza e consolida a legislação sobre direitos autorais e dá outras providências; c) Lei nº 12.527 de 18 de novembro de 2011 - Regula o acesso a informações previsto no inciso XXXIII do art. 5º , no inciso II do § 3º do art. 37 e no § 2º do art. 216 da Constituição Federal; altera a Lei nº 8.112, de 11 de dezembro de 1990; revoga a Lei nº 11.111, de 5 de maio de 2005, e dispositivos da Lei nº 8.159, de 8 de janeiro de 1991; e dá outras providências; d) Decreto nº 2.553 de 16 de abril de 1998 - Regulamenta os artigos. 75 e 88 a 93 da Lei nº 9.279, de 14 de maio de 1996, que regula direitos e obrigações relativos à propriedade industrial."
    ],
    "ground_truth": [
      "Aprova a proposta de creditação curricular das atividades acadêmicas de extensão (AAEs) nos cursos de graduação da Universidade Tecnológica Federal do Paraná - UTFPR"
    ],
    "metadata": {
      "embedding_model": "all-mpnet-base-v2",
      "process_time": 37.790000200271606
    }
  },
  {
    "question": "O que resolve a Resolução nº 36/2020 - COGEP?",
    "answer": "Você é um assistente especializado em documentos oficiais da UTFPR. Responda à pergunta usando APENAS as informações fornecidas no contexto abaixo.\nSe a informação não estiver disponível no contexto, diga que não pode responder.\nSe houver múltiplas informações relacionadas, forneça uma resposta completa e organizada.\nTente entender melhor o que diz o contexto, para fornecer informações extras.\n---\nContexto:\nRESOLVE: I - aprovar, nos termos do documento sei 2200599, a proposta de implementação de modalidades de ensino e calendário acadêmico para o segundo período de 2021 e períodos subsequentes, em anexo; II - retificar a resolução COGEP 48 documento SEI 1788983.\n\n7.9. DA DISPONIBILIZAÇÃO DO GABARITO E DAS NOTAS 7.9.1. Da Prova de Conhecimentos Gerais 7.9.1.1. No dia 25/11/2024, até as 18h, o cadern o de provas será divulgado na página da UTFPR, no endereço eletrônico: https://www.utfpr.edu.br/cursos/tecnico/exame-de-selecao. 7.9.1.2.1. no dia 25/11/2024, até as 18h, o gabarito provisório oficial das questões objetivas das provas das áreas de conhecimento, será divulgado na página da UTFPR, no endereço eletrônico: https://www.utfpr.edu.br/cursos/tecnico/exame-de-selecao. 7.9.1.2.2. Após a publicação do gabarito oficial, os candidatos poderão, no dia 26/11/2024, enviar a contestação ao Núcleo de Concurso, exclusivamente na Plataforma de Inscrições para o EXAME DE SELEÇÃO 2025, informando o número da questão e a justificativa. 7.9.1.2.2.1. Entende-se por contestação manifestações fundamentadas visando obter reforma ou modificação das alternativas de uma ou mais questões objetivas da(s) prova(s) de conhecimentos, elencadas como sendo as corretas no gabarito oficial divulgado pela UTFPR, ou ainda o pedido de anulação de uma ou mais questões da(s) prova(s) de conhecimentos. 7.9.1.2.2.2. Serão aceitos questionamentos sobre o gabarito provisório das questões objetivas, desde que fundamentados exclusivamente com base no Programa Oficial de Prova estabelecido para o EXAME DE SELEÇÃO 2025. O programa consta no Anexo II deste Edital. 7.9.1.2.2.3. Os recursos em desacordo c om o Item 7.9.1.2.2.2. ser ão prontamente indeferidos por falta de objeto ou intempestividade. 7.9.1.2.2.4. O espaço reservado ao texto do recurso não poderá conter qualquer palavra ou marca que identifique o candidato, sob pena de ser preliminarmente indeferido. 7.9.1.2.2.5. O recurso será apreciado por Banca Examinadora, a qual emitirá decisão fundamentada, que será colocada à disposição do requerente a partir do dia 27/11/2024. 7.9.1.2.2.6. No caso de deferimento de contestação, a UTFPR procederá à retificação do gabarito oficial, cuja versão definitiva, será divulgada integralmente no site oficial da UTFPR-CM, no endereço eletrônico: https://www.utfpr.edu.br/cursos/tecnico/exame-de-selecao, no dia 27/11/2024, e essa será a versão do gabarito para a formação das notas dos candidatos no resultado da classificação. 7.9.1.2.2.7. A Banca Examinadora constitui última instância para recurso, sendo soberana em suas decisões, razão pela qual não caberão recursos adicionais. 7.9.1.2.2.8. À exceção dos recursos previstos, não se concederá revisão de provas, recontagem de pontos das provas, segunda chamada ou vistas das provas, devido às características do EXAME DE SELEÇÃO 2025. 7.9.1.2.2.9. Caso alguma questão objetiva seja anulada, a pontuação correspondente será atribuída a todos os candidatos, desde que já não tenha recebido a pontuação por esta questão. 7.9.1.2.2.10. Se h ouver alteração do item de resposta, por força de impugnação do gabarito provisório, essa alteração valerá para todos os candidatos, independentemente de terem recorrido. 7.9.2. Da Leitura do Cartão Resposta 7.9.2.1. No dia 04/12/2024, será publicado o resultado do processamento da leitura óptica do cartão-resposta, na Plataforma de Inscrições para o EXAME DE SELEÇÃO 2025. 7.9.2.2. Serão aceitos questionamentos sobre o processamento do cartão-resposta no período de 05/12/2024 e 06/12/2024. 7.9.2.2.1. Os questionamentos devem estar fundamentados e apresentados em formulário específico disponibilizado na Plataforma de Inscrições para o EXAME DE SELEÇÃO 2025, devendo o candidato\n\nArt. 34 – Em caso de falta a 3 (três) reuniões da Câmara Técnica e/ou da Plenária do COGEP em um período de 12 (doze) meses, sem justificativas acatadas, por decisão da Plenária e formalizada por deliberação do Presidente do COGEP o Conselheiro perderá o mandato.\n\nArt. 5º O CGD terá a seguinte composição, na forma do § 1º do art. 2º do Decreto nº 10.332, de 2020: I - presidente: Vice-Reitor(a), como responsável pelo alinhamento estratégico; II - representantes das áreas finalísticas, como responsáveis pelas áreas de negócio: a) Pró-Reitor(a) de Graduação e Educação Profissional (PROGRAD); b) Pró-Reitor(a) de Pesquisa e Pós-Graduação (PROPPG); c) Pró-Reitor(a) de Relações Empresariais e Comunitárias (PROREC); III - Diretor(a) de Gestão de Tecnologia da Informação (DIRGTI), como responsável pela área técnica; IV - Encarregado(a) pelo Tratamento de Dados Pessoais de que trata a Lei Geral de Proteção de Dados (LGPD), nos termos da Lei nº 13.709, de 14 de agosto de 2018, como responsável pela área técnica. § 1° Cada membro do colegiado terá um suplente, que o substituirá em suas ausências e impedimentos. § 2º Na impossibilidade de participação do membro titular ou de seu respectivo suplente em reunião convocada pelo CGD, o(a) representante da área de que trata o caput deste artigo deverá, quando da convocação, indicar expressamente ao(à) Presidente o(a) servidor(a) que a representará. § 3° O CGD poderá convidar representantes de outras áreas e entidades para participar de suas reuniões, sem direito a voto.\n\nPRESTAÇÃO DE CONTAS ENVIADA À DIRPPG até 14/10/2023 Não ocorrendo o gasto do recurso e sua devolução, o valor originalmente concedido será atualizado monetariamente, acrescido de juros legais, na forma da legislação aplicável aos débitos para com a Fazenda Federal.\n---\nPergunta: O que resolve a Resolução nº 36/2020 - COGEP?\nResposta: A nova redacção do Art. 33 incluem dois parágrafos novos, bem como alguns elementos do corpo legal antecessoras.\nO novo parágrafo 19 (§ 2 º ) garante que todas as atividades regulatórias realizadas após o dia 01 de setembro de 2004 devam cumprir rigorosa e imediata puni dade s quanto ás atua çõ es regula t ó rias, incluindo quaisquer normativadescrevendodelegador do CNDES, e também preservam o caráter penalísticodisciplina das normas constanteadores, mesmo que nem sequencial nem eventualmente.\nO Parágrafo 20 adicional (parágraphofrom the previous section), foi integrado diretamentametodo de controledeprocedimento regular, assimcomo outros itens mencionados neste trecho\nFavor considerar esses elementos de integraçãoparamentadodelgadoanterior,\nNo presente edital, foram inseridos três fases distintas do processo regulatorio, cada uma caracterizandospécificas formas de controloterminadorespreenchimentoperiodicos.\nPor fim,favoreconhecerquelesfascinsublinetototalapresentedominantementeefectuvenumerouspunctualprocessessomewhatsubtlecompletelydesirablecharacteristicsthatdifferfromtheformersectionseachwaselementreducingnumerouslyinnumberoffunctionalcomponents,suchthatnolessensuresomeonesomethingelsewhathappenedbeforewithsimilarities,butnotthesamesimilaries.\nConsideravelasalteraçõesaoconteudoconstituidoporumermudossembravidentesimpressivosestranjaspapeloidiautosimparesmaioraposialacomunicaçãocontrabandeirodiversasobertemporalismasoutroselementossupressordissidentsignalsnucleusorgansautonomousegemonyexclusivelyonthebehalfoftthelowerepresentativeforthepurposeofdefiningthedifferentiableentitiesrespectingwhichpersonaltipsarecognizedtowardsthenumberassignedtherebywithoutanyconsiderationbeinggivenaboutthemaccordinglyuponreceipt.",
    "contexts": [
      "RESOLVE: I - aprovar, nos termos do documento sei 2200599 , a proposta de implementação de modalidades de ensino e calendário acadêmico para o segundo período de 2021 e períodos subsequentes, em anexo; II - retificar a resolução COGEP 48 documento SEI 1788983 .",
      "7.9. DA DISPONIBILIZAÇÃO DO GABARITO E DAS NOTAS 7.9.1. Da Prova de Conhecimentos Gerais 7.9.1.1. No dia 25/11/2024 , até as 18h, o cadern o de provas será divulgado na página da UTFPR, no endereço eletrônico: https://www.utfpr.edu.br/cursos/tecnico/exame-de-selecao . 7.9.1.2.1. no dia 25/11/2024, até as 18h, o gabarito provisório oficial das questões objetivas das provas das áreas de conhecimento, será divulgado na página da UTFPR, no endereço eletrônico: https://www.utfpr.edu.br/cursos/tecnico/exame-de-selecao . 7.9.1.2.2. Após a publicação do gabarito oficial, os candidatos poderão, no dia 26/11/2024 , enviar a contestação ao Núcleo de Concurso, exclusivamente na Plataforma de Inscrições para o EXAME DE SELEÇÃO 2025 , informando o número da questão e a justificativa. 7.9.1.2.2.1. Entende-se por contestação manifestações fundamentadas visando obter reforma ou modificação das alternativas de uma ou mais questões objetivas da(s) prova(s) de conhecimentos, elencadas como sendo as corretas no gabarito oficial divulgado pela UTFPR, ou ainda o pedido de anulação de uma ou mais questões da(s) prova(s) de conhecimentos. 7.9.1.2.2.2. Serão aceitos questionamentos sobre o gabarito provisório das questões objetivas, desde que fundamentados exclusivamente com base no Programa Oficial de Prova estabelecido para o EXAME DE SELEÇÃO 2025. O programa consta no Anexo II deste Edital. 7.9.1.2.2.3. Os recursos em desacordo c om o Item 7.9.1.2.2.2. ser ão prontamente indeferidos por falta de objeto ou intempestividade. 7.9.1.2.2.4. O espaço reservado ao texto do recurso não poderá conter qualquer palavra ou marca que identifique o candidato, sob pena de ser preliminarmente indeferido. 7.9.1.2.2.5. O recurso será apreciado por Banca Examinadora, a qual emitirá decisão fundamentada, que será colocada à disposição do requerente a partir do dia 27/11/2024 . 7.9.1.2.2.6. No caso de deferimento de contestação, a UTFPR procederá à retificação do gabarito oficial, cuja versão definitiva, será divulgada integralmente no site oficial da UTFPR-CM, no endereço eletrônico: https://www.utfpr.edu.br/cursos/tecnico/exame-de-selecao , no dia 27/11/2024, e essa será a versão do gabarito para a formação das notas dos candidatos no resultado da classificação. 7.9.1.2.2.7. A Banca Examinadora constitui última instância para recurso, sendo soberana em suas decisões, razão pela qual não caberão recursos adicionais. 7.9.1 .2.2.8. À exceção dos recursos previstos, não se concederá revisão de provas, recontagem de pontos das provas, segunda chamada ou vistas das provas, devido às características do EXAME DE SELEÇÃO 2025. 7.9.1.2.2.9. Caso alguma questão objetiva seja anulada, a pontuação correspondente será atribuída a todos os candidatos, desde que já não tenha recebido a pontuação por esta questão. 7.9.1.2.2.10. Se h ouver alteração do item de resposta, por força de impugnação do gabarito provisório, essa alteração valerá para todos os candidatos, independentemente de terem recorrido. 7.9.2. Da Leitura do Cartão Resposta 7.9.2.1. No dia 04/12/2024 , será publicado o resultado do processamento da leitura óptica do cartão-resposta, na Plataforma de Inscrições para o EXAME DE SELEÇÃO 2025. 7.9.2.2. Serão aceitos questionamentos sobre o processamento do cartão-resposta no período de 05/12/2024 e 06/12/2024 . 7.9.2.2.1. Os questionamentos devem estar fundamentados e apresentados em formulário específico disponibilizado na Plataforma de Inscrições para o EXAME DE SELEÇÃO 2025 , devendo o candidato",
      "Art. 34 – Em caso de falta a 3 (três) reuniões da Câmara Técnica e/ou da Plenária do COGEP em um período de 12 (doze) meses, sem justificativas acatadas, por decisão da Plenária e formalizada por deliberação do Presidente do COGEP o Conselheiro perderá o mandato.",
      "Art. 5º O CGD terá a seguinte composição, na forma do § 1º do art. 2º do Decreto nº 10.332, de 2020: I - presidente: Vice-Reitor(a), como responsável pelo alinhamento estratégico; II - representantes das áreas finalísticas, como responsáveis pelas áreas de negócio: a) Pró-Reitor(a) de Graduação e Educação Profissional (PROGRAD); b) Pró-Reitor(a) de Pesquisa e Pós-Graduação (PROPPG); c) Pró-Reitor(a) de Relações Empresariais e Comunitárias (PROREC); III - Diretor(a) de Gestão de Tecnologia da Informação (DIRGTI), como responsável pela área técnica; IV - Encarregado(a) pelo Tratamento de Dados Pessoais de que trata a Lei Geral de Proteção de Dados (LGPD), nos termos da Lei nº 13.709, de 14 de agosto de 2018, como responsável pela área técnica. § 1° Cada membro do colegiado terá um suplente, que o substituirá em suas ausências e impedimentos. § 2º Na impossibilidade de participação do membro titular ou de seu respectivo suplente em reunião convocada pelo CGD, o(a) representante da área de que trata o caput deste artigo deverá, quando da convocação, indicar expressamente ao(à) Presidente o(a) servidor(a) que a representará. § 3° O CGD poderá convidar representantes de outras áreas e entidades para participar de suas reuniões, sem direito a voto.",
      "PRESTAÇÃO DE CONTAS ENVIADA À DIRPPG até 14/10/2023 Não ocorrendo o gasto do recurso e sua devolução, o valor originalmente concedido será atualizado monetariamente, acrescido de juros legais, na forma da legislação aplicável aos débitos para com a Fazenda Federal."
    ],
    "ground_truth": [
      "Aprova o Regulamento para Concessão do Auxílio Estudantil Emergencial para Estudantes Matriculados nos Cursos Regulares da UTFPR"
    ],
    "metadata": {
      "embedding_model": "all-mpnet-base-v2",
      "process_time": 31.09798502922058
    }
  },
  {
    "question": "Quais são as atribuições do Presidente do Colegiado de Curso?",
    "answer": "O Presidente da Mesa Coordenaora\nPágina inicial",
    "contexts": [
      "Art. 17. Da decisão proferida pelo Colégio Eleitoral, cabe recurso ao seu Presidente, pelos candidatos ou por qualquer integrante da comunidade acadêmica votante, até às 16 horas do dia 07 de abril de 2020. Parágrafo único. O recurso interposto em petição dirigida ao Presidente do Colégio Eleitoral deverá conter: I) o nome e a qualificação do interessado; II) os fundamentos de fato e de direito; e III) o pedido de revisão da decisão proferida.",
      "Art. 14º A Comissão Central, doravante “comissão”, será formada por membros titulares, na seguinte composição: a) 2 (dois) servidores de cada campus da UTFPR, indicados pelo Diretor Geral do campus; b) 2 (dois) discentes de graduação, indicados por parte de representação estudantil formalmente constituída; c) 2 (dois) discentes de pós-graduação, indicados por parte de representação estudantil formalmente constituída; d) 1 (um) representante sindical, indicado em conjunto pela representação sindical docente e de técnicos administrativos; e) Até 2 (dois) membros da sociedade civil organizada vinculada ao debate antirracista; f) 1 (um) presidente, indicado pelo(a) reitor(a); g) 1 (um) vice-presidente, indicado pelo(a) reitor(a); h) 1 (um) secretário(a), indicado pelo(a) reitor(a); § 1º Todos os membros deverão ser maiores de 18 (dezoito) anos e deve-se, ainda, atender ao critério da diversidade, garantindo que seus membros sejam distribuídos por gênero, cor e, preferencialmente, naturalidade brasileira. § 2º Os membros devem propor e realizar cursos de formação e participar de eventos, ações e atividades na temática da promoção da igualdade racial e do combate e eliminação do racismo, da discriminação racial, da xenofobia e da intolerância, e atividades formativas direcionadas à atuação em bancas de heteroidentificação. § 3º Esta comissão é de caráter permanente e deve renovar-se de 4 (quatro) em 4 (quatro) anos, tendo no mínimo 30% (trinta por cento) dos seus membros preservados e que podem ser renovados no próximo interstício. § 4º Para as alíneas (a) a (e) poderá haver a indicação de até um membro suplente para cada membro titular; § 5º A cada ano, a comissão deve apresentar à autoridade instauradora relatório técnico, analítico e avaliativo das atividades realizadas no interstício.",
      "Art. 5º O CGD terá a seguinte composição, na forma do § 1º do art. 2º do Decreto nº 10.332, de 2020: I - presidente: Vice-Reitor(a), como responsável pelo alinhamento estratégico; II - representantes das áreas finalísticas, como responsáveis pelas áreas de negócio: a) Pró-Reitor(a) de Graduação e Educação Profissional (PROGRAD); b) Pró-Reitor(a) de Pesquisa e Pós-Graduação (PROPPG); c) Pró-Reitor(a) de Relações Empresariais e Comunitárias (PROREC); III - Diretor(a) de Gestão de Tecnologia da Informação (DIRGTI), como responsável pela área técnica; IV - Encarregado(a) pelo Tratamento de Dados Pessoais de que trata a Lei Geral de Proteção de Dados (LGPD), nos termos da Lei nº 13.709, de 14 de agosto de 2018, como responsável pela área técnica. § 1° Cada membro do colegiado terá um suplente, que o substituirá em suas ausências e impedimentos. § 2º Na impossibilidade de participação do membro titular ou de seu respectivo suplente em reunião convocada pelo CGD, o(a) representante da área de que trata o caput deste artigo deverá, quando da convocação, indicar expressamente ao(à) Presidente o(a) servidor(a) que a representará. § 3° O CGD poderá convidar representantes de outras áreas e entidades para participar de suas reuniões, sem direito a voto.",
      "Art. 28. Compete ao Presidente da Mesa: I) garantir o sigilo na recepção dos votos; II) dirimir eventuais dúvidas sobre a aplicação deste Regulamento; III) manter a ordem no recinto onde se encontra a Mesa; IV) comunicar à Presidência da Subcomissão as ocorrências relevantes; V) rubricar as cédulas, com mais um membro da Mesa, e registrar a quantidade de cédulas rubricadas de cada segmento; VI) assegurar a inviolabilidade da urna; VII) determinar as providências cabíveis para a lavratura da ata; e VIII) diligenciar para que o votante assine corretamente a lista nominal de comparecimento à consulta. § 1° O Presidente da Mesa deve estar presente ao ato de abertura e de encerramento da consulta. § 2° Cabe aos membros da Mesa cumprirem as determinações do Presidente da Mesa.",
      "I. Coordenador de projeto de pesquisa, de extensão e/ou de inovação, com chancela de uma Pró-Reitoria, como de desenvolvimento institucional, implantação/melhoria de infraestrutura, capacitação ou outro e que tenha financiamento do Ministério da Ciência, Tecnologia, Inovação e Comunicação (MCTIC), Ministério da Educação (MEC), Ministério de Desenvolvimento Social (MDS), Ministério da Cultura (MC) e órgãos assemelhados, pelo tempo de duração do projeto;"
    ],
    "ground_truth": [
      "Convocar e presidir as reuniões, com direito a voto de qualidade (voto de desempate);",
      "Designar Secretário;",
      "Aprovar a ata das reuniões anteriores, homologando-as no Colegiado;",
      "Elaborar a pauta das reuniões, com assuntos de interesse do Curso ou encaminhados pelos membros do Colegiado ou docentes/servidores técnico-administrativos vinculados ao Curso;",
      "Distribuir os processos para a análise do Colegiado, nomeando seus relatores com antecedência mínima de 72 (setenta e duas) horas da reunião;",
      "Constituir Comissões;",
      "Baixar atos visando à organização interna;",
      "Dar posse aos membros do Colegiado e,",
      "Indicar comissão para a eleição."
    ],
    "metadata": {
      "embedding_model": "all-mpnet-base-v2",
      "process_time": 2.8980014324188232
    }
  }
]