[
  {
    "question": "Quais os dias e horarios da semana em que acontecem as aulas da disciplina Árvores e Grafos?",
    "answer": "Não há informações sobre os dias e horarios de aulas da disciplina Árvores e Grafos no contexto.",
    "contexts": [
      "O professor Fabricio Correia De Oliveira pertence ao departamento STRICTO e está ativo no período 2025/1.",
      "O professor Adriana Maria Meneghetti pertence ao departamento STRICTO e está ativo no período 2025/1.",
      "O professor Adriana Aparecida Droval pertence ao departamento STRICTO e está ativo no período 2025/1.",
      "O professor Rafael Porto Ineu pertence ao departamento STRICTO e está ativo no período 2025/1.",
      "O professor Euclides Peres Farias Junior pertence ao departamento STRICTO e está ativo no período 2025/1."
    ],
    "ground_truth": [
      "Quinta-feira: t3 (14:40-15:30), t4 (15:50-16:40) - Sala L18",
      "Terca-feira: t4 (15:50-16:40), t5 (16:40-17:30) - Sala L18"
    ],
    "metadata": {
      "embedding_model": "all-mpnet-base-v2",
      "process_time": 2.3470304012298584
    }
  },
  {
    "question": "A disciplina Aspectos Formais Da Computacao acontece de manhã ou de tarde?",
    "answer": "Não pode responder, a informação não está disponível no contexto.",
    "contexts": [
      "O professor Angela Maria Gozzo ministra a disciplina Estágio Na Docência Ii (TAM78) para a turma PPGTA no formato Presencial.",
      "O professor Angela Maria Gozzo ministra a disciplina Estágio Na Docência I (TAM35) para a turma PPGTA no formato Presencial.",
      "O professor Laercio Mantovani Frare ministra a disciplina Estágio Docente (TAMB201) para a turma PPGTAMB no formato Presencial.",
      "O professor Evando Carlos Pizzini ministra a disciplina Aspectos Formais Da Computação (CC56E) para a turma CC6 no formato Presencial.\nHorários:\n- Segunda-feira: m4 (10:20-11:10), m5 (11:10-12:00) - Sala L15\n- Terca-feira: m1 (07:30-08:20) - Sala L15",
      "O professor Elias Lira Dos Santos Junior ministra a disciplina Trabalho De Conclusão Do Curso (PROFNIT22) para a turma PROFNIT no formato Presencial."
    ],
    "ground_truth": [
      "de manhã"
    ],
    "metadata": {
      "embedding_model": "all-mpnet-base-v2",
      "process_time": 1.9702556133270264
    }
  },
  {
    "question": "Qual a turma e a sala da disciplina Teoria Da Computação?",
    "answer": "CC5, Sala L15",
    "contexts": [
      "O professor Evando Carlos Pizzini ministra a disciplina Teoria Da Computação (COM1025) para a turma CC5 no formato Presencial.\nHorários:\n- Quinta-feira: t1 (13:00-13:50), t2 (13:50-14:40) - Sala L15\n- Segunda-feira: t1 (13:00-13:50), t2 (13:50-14:40), t3 (14:40-15:30) - Sala L15"
    ],
    "ground_truth": [
      "Turma: CC5",
      "Sala: L15"
    ],
    "metadata": {
      "embedding_model": "all-mpnet-base-v2",
      "process_time": 1.1620006561279297
    }
  },
  {
    "question": "A qual departamento pertence o professor Aikes?",
    "answer": "O professor Aikes pertence ao departamento DACOM.",
    "contexts": [
      "O professor Jorge Aikes Junior pertence ao departamento DACOM e está ativo no período 2025/1.",
      "O professor Daiene De Mello Schaefer pertence ao departamento DAFIS e está ativo no período 2025/1.",
      "O professor - DAFIS_1 pertence ao departamento DAFIS e está ativo no período 2025/1.",
      "O professor Estor Gnoatto pertence ao departamento DAELE e está ativo no período 2025/1.",
      "O professor Gilvan Moises Bertollo pertence ao departamento STRICTO e está ativo no período 2025/1."
    ],
    "ground_truth": [
      "DACOM"
    ],
    "metadata": {
      "embedding_model": "all-mpnet-base-v2",
      "process_time": 1.4549729824066162
    }
  },
  {
    "question": "A qual departamento pertence o professor Jorge Aikes Junior?",
    "answer": "DACOM",
    "contexts": [
      "O professor Jorge Aikes Junior pertence ao departamento DACOM e está ativo no período 2025/1.",
      "O professor Jorge Aikes Junior ministra a disciplina Sistemas Inteligentes Aplicados (CC57A) para a turma CC7 no formato Presencial.\nHorários:\n- Quinta-feira: t4 (15:50-16:40), t5 (16:40-17:30) - Sala L16\n- Terca-feira: t4 (15:50-16:40), t5 (16:40-17:30) - Sala L16",
      "O professor Jorge Aikes Junior ministra a disciplina Construção De Compiladores (CC57B) para a turma CC7 no formato Presencial.\nHorários:\n- Quinta-feira: t2 (13:50-14:40), t3 (14:40-15:30) - Sala L16\n- Terca-feira: t2 (13:50-14:40), t3 (14:40-15:30) - Sala L16",
      "O professor Jorge Aikes Junior ministra a disciplina Realidade Virtual (OP63F) para a turma CC8 no formato Presencial.\nHorários:\n- Segunda-feira: m4 (10:20-11:10), m5 (11:10-12:00) - Sala L16\n- Terca-feira: m2 (08:20-09:10), m3 (09:10-10:00) - Sala L16"
    ],
    "ground_truth": [
      "DACOM"
    ],
    "metadata": {
      "embedding_model": "all-mpnet-base-v2",
      "process_time": 1.4379987716674805
    }
  },
  {
    "question": "Quais as disciplinas o professor Jorge Aikes Junior ministra?",
    "answer": "- CC57A\n- CC57B\n- OP63F",
    "contexts": [
      "O professor Jorge Aikes Junior pertence ao departamento DACOM e está ativo no período 2025/1.",
      "O professor Jorge Aikes Junior ministra a disciplina Sistemas Inteligentes Aplicados (CC57A) para a turma CC7 no formato Presencial.\nHorários:\n- Quinta-feira: t4 (15:50-16:40), t5 (16:40-17:30) - Sala L16\n- Terca-feira: t4 (15:50-16:40), t5 (16:40-17:30) - Sala L16",
      "O professor Jorge Aikes Junior ministra a disciplina Construção De Compiladores (CC57B) para a turma CC7 no formato Presencial.\nHorários:\n- Quinta-feira: t2 (13:50-14:40), t3 (14:40-15:30) - Sala L16\n- Terca-feira: t2 (13:50-14:40), t3 (14:40-15:30) - Sala L16",
      "O professor Jorge Aikes Junior ministra a disciplina Realidade Virtual (OP63F) para a turma CC8 no formato Presencial.\nHorários:\n- Segunda-feira: m4 (10:20-11:10), m5 (11:10-12:00) - Sala L16\n- Terca-feira: m2 (08:20-09:10), m3 (09:10-10:00) - Sala L16"
    ],
    "ground_truth": [
      "Construção De Compiladores",
      "Realidade Virtual",
      "Sistemas Inteligentes Aplicados"
    ],
    "metadata": {
      "embedding_model": "all-mpnet-base-v2",
      "process_time": 2.3639681339263916
    }
  },
  {
    "question": "Qual professor ministra a disciplina de Realidade Virtual?",
    "answer": "Esta informação não está disponível no contexto.",
    "contexts": [
      "O professor Evandro Andre Konopatzki ministra a disciplina Oficina Profissional (PROFNIT50) para a turma PNIT no formato Presencial.",
      "O professor - STRICTO EXTERNO pertence ao departamento STRICTO e está ativo no período 2025/1.",
      "O professor Osvaldo Valarini Junior pertence ao departamento STRICTO e está ativo no período 2025/1.",
      "O professor - DEBORAH C pertence ao departamento STRICTO e está ativo no período 2025/1.",
      "O professor Patricia Valderrama pertence ao departamento STRICTO e está ativo no período 2025/1."
    ],
    "ground_truth": [
      "Jorge Aikes Junior"
    ],
    "metadata": {
      "embedding_model": "all-mpnet-base-v2",
      "process_time": 1.1519899368286133
    }
  }
]