[
  {
    "question": "Qual documento Regulamenta a oferta de cursos de graduação na modalidade de Educação a Distância (EaD) e a oferta de carga horária na modalidade de EaD nos cursos de graduação presenciais da Universidade Tecnológica Federal do Paraná.",
    "answer": "Artigo\nRegimento Geral\nRecurso Especial",
    "contexts": [
      "Art. 1º Aprovar o regulamento da oferta de cursos de graduação na modalidade de Educação a Distância (EaD) e da oferta de carga horária na modalidade de EaD nos cursos de graduação presenciais da Universidade Tecnológica Federal do Paraná (UTFPR), conforme anexo I.",
      "Art. 1º Ficam instituídas, por meio da presente resolução, as regras para a oferta, organização e o desenvolvimento de cursos na modalidade de Educação a Distância (EaD) e a inserção de carga horária na modalidade de EaD nos cursos presenciais de graduação da UTFPR.",
      "Art. 1º Esta Instrução Normativa estabelece as normas e as diretrizes para a operacionalização do Estágio Supervisionado Curricular Obrigatório no âmbito do Curso de Licenciatura em Informática, do Campus Francisco Beltrão da Universidade Tecnológica Federal do Paraná – UTFPR. Do local",
      "PIBIT - Estudantes dos cursos de graduação da UTFPR ou Instituições de cursos superiores parceiras do Estado do Paraná 8.9 Receber apenas uma modalidade de bolsa a que foi indicada, sendo vedada a acumulação com outras. 8.9.1 A bolsa de Iniciação Tecnológica poderá ser concedida em concomitância para estudantes beneficiados por programas oficiais com objetivos assistenciais, de manutenção ou de permanência do(a) estudante durante o período da graduação. 8.10 Dedicar individualmente vinte (20) horas semanais recomendadas para a execução do Plano de Trabalho. 8.11 Em caso de afastamento do(a) estudante, o Departamento de Iniciação Científica e Tecnológica deverá ser informado, via SEI/DEICT (Tipo de Processo: Pesquisa, Iniciação Científica), com justificativa e anuência do orientador:",
      "Art. 1º O presente Regulamento tem por objetivo disciplinar o afastamento de servidores da Universidade Tecnológica Federal do Paraná (UTFPR) para a realização de pós-graduação stricto sensu ou estágio de pós-doutorado. Parágrafo único - O estágio de pós-doutorado é um estágio acadêmico realizado por portadores de título de doutor obtido em programa de pós-graduação stricto sensu e é caracterizado como atividade de pesquisa para aprimorar o nível de excelência em uma determinada área."
    ],
    "ground_truth": [
      "A Resolução COGEP/UTFPR Nº 181, de 9 de agosto de 2022."
    ],
    "metadata": {
      "embedding_model": "paraphrase-multilingual-MiniLM-L12-v2",
      "process_time": 2.010014295578003
    }
  },
  {
    "question": "Qual documento Regulamenta as atividades complementares (ACs) dos cursos de graduação?",
    "answer": "Você é um assistente especializado em documentos oficiais da UTFPR. Responda à pergunta usando APENAS as informações fornecidas no contexto abaixo.\nSe a informação não estiver disponível no contexto, diga que não pode responder.\nSe houver múltiplas informações relacionadas, forneça uma resposta completa e organizada.\nTente entender melhor o que diz o contexto, para fornecer informações extras.\n---\nContexto:\nArt. 17. Os cursos de graduação poderão prever, de acordo com o estabelecido nas DCNs do curso e a legislação vigente: I - o estágio curricular não obrigatório; II - o TCC; e III - as atividades complementares.\n\nArt. 16. Os cursos de graduação deverão prever, conforme regulamentação específica da UTFPR e a legislação vigente: I - o estágio curricular obrigatório; II - as atividades de extensão; e III - para os cursos de licenciatura deverão ser previstas as Atividades Práticas como Componente Curricular (APCC).\n\nArt. 7º - A admissão nos cursos de graduação far-se-á por meio de editais de processos seletivos, acordos de dupla diplomação em que haja reciprocidade de intercâmbio de estudantes, e programas propostos pelo Ministério da Educação dos quais a UTFPR seja signatária. Parágrafo único. Os editais dos processos seletivos serão elaborados e divulgados pela PROGRAD.\n\nNORMATIZAÇÃO. REGULAMENTAÇÃO. Incluem-se documentos referentes à concepção, organização e funcionamento do ensino superior. Enquanto vigora - Guarda Permanente 120 CURSOS DE GRADUAÇÃO (inclusive na modalidade a distância)\n\nCONSELHO DE GRADUAÇÃO E EDUCAÇÃO PROFISSIONAL (Secretaria) Curitiba, 01 de abril de 2021. Resolução cogep/utfpr nº 65/2021 Ajuste dos artigos 15 e 16 do Regulamento das atividades complementares dos cursos de Graduação da UTFPR (resolução nº 56/07 – COEPP, de 22 de junho de 2007) O PRESIDENTE DO CONSELHO DE GRADUAÇÃO E EDUCAÇÃO PROFISSIONAL DA UNIVERSIDADE TECNOLÓGICA FEDERAL DO PARANÁ, no uso de suas atribuições,\n---\nPergunta: Qual documento Regulamenta as atividades complementares (ACs) dos cursos de graduação?\nResposta: Artigo 18\n---\n\n#### Exercício\n\n##### Ponto 2\n\nO presidente do conselho de grau e educação profissional da universidade tecnológica federal do paraná, no uso de seus atributos,\n\n1° Considerando a normativa legal que regula as relações entre as instituições educacionais, bem como o Estatuto Acadêmico e Nacional;\n\n2° Prestando atenção ao encontro ocorrido no dia XXXX/XXXX entre os seguintes convênios:\n\n### RESPOSTA AO EXERCÍCIO\n\nAs perguntas estão definidas pelos itens presentidos na parte inferior do exercícito.\nExiste alguma dúvida quanto às respostas?",
    "contexts": [
      "Art. 17. Os cursos de graduação poderão prever, de acordo com o estabelecido nas DCNs do curso e a legislação vigente: I - o estágio curricular não obrigatório; II - o TCC; e III - as atividades complementares.",
      "Art. 16. Os cursos de graduação deverão prever, conforme regulamentação específica da UTFPR e a legislação vigente: I - o estágio curricular obrigatório; II - as atividades de extensão; e III - para os cursos de licenciatura deverão ser previstas as Atividades Práticas como Componente Curricular (APCC).",
      "Art. 7º - A admissão nos cursos de graduação far-se-á por meio de editais de processos seletivos, acordos de dupla diplomação em que haja reciprocidade de intercâmbio de estudantes, e programas propostos pelo Ministério da Educação dos quais a UTFPR seja signatária. Parágrafo único. Os editais dos processos seletivos serão elaborados e divulgados pela PROGRAD.",
      "NORMATIZAÇÃO. REGULAMENTAÇÃO. Incluem-se documentos referentes à concepção, organização e funcionamento do ensino superior. Enquanto vigora - Guarda Permanente 120 CURSOS DE GRADUAÇÃO (inclusive na modalidade a distância)",
      "CONSELHO DE GRADUAÇÃO E EDUCAÇÃO PROFISSIONAL (Secretaria) Curitiba, 01 de abril de 2021. Resolução cogep/utfpr nº 65/2021 Ajuste dos artigos 15 e 16 do Regulamento das atividades complementares dos cursos de Graduação da UTFPR (resolução nº 56/07 – COEPP, de 22 de junho de 2007) O PRESIDENTE DO CONSELHO DE GRADUAÇÃO E EDUCAÇÃO PROFISSIONAL DA UNIVERSIDADE TECNOLÓGICA FEDERAL DO PARANÁ , no uso de suas atribuições,"
    ],
    "ground_truth": [
      "A Resolução COGEP/UTFPR Nº 179, de 4 de agosto de 2022."
    ],
    "metadata": {
      "embedding_model": "paraphrase-multilingual-MiniLM-L12-v2",
      "process_time": 8.45400071144104
    }
  },
  {
    "question": "O que resolve a Resolução COGEP/UTFPR Nº 167, de 24 de junho de 2022?",
    "answer": "Você é um assistente especializado em documentos oficiais da UTFPR. Responda à pergunta usando APENAS as informações fornecidas no contexto abaixo.\nSe a informação não estiver disponível no contexto, diga que não pode responder.\nSe houver múltiplas informações relacionadas, forneça uma resposta completa e organizada.\nTente entender melhor o que diz o contexto, para fornecer informações extras.\n---\nContexto:\nArt. 2º Revogar a Resolução nº 90/2018 - COGEP, de 03 de dezembro de 2018 e retificada em 25 de abril de 2019 (SEI nº 0590328 e SEI nº 0797224 ) e a Resolução COGEP/UTFPR nº 85/2021, de 14 de julho de 2021 (SEI nº 2141324 ).\n\nArt. 3º Ficam revogadas a Resolução nº 61/06 – COEPP, de 01 de setembro de 2006, retificada pela Resolução nº 56/07 – COEPP, de 22 de junho de 2007 e pela Resolução COGEP/UTFPR nº 65/2021, de 01 de abril de 2021, publicada no Boletim de Serviço Eletrônico em 06/04/2021; e a Resolução COGEP/UTFPR nº 158, de 11 de maio de 2022, publicada no Boletim de Serviço Eletrônico em 12/05/2022.\n\nArt. 1° Homologar a RESOLUÇÃO COUNI/UTFPR nº 59, de 28 de dezembro de 2021, e a RESOLUÇÃO COUNI/UTFPR nº 60, de 28 de dezembro de 2021, ambas ad referendum, referentes à atividade docente na UTFPR durante a pandemia do novo coronavírus (Covid-19).\n\nArt. 1º Homologar a RESOLUÇÃO COUNI/UTFPR/AD REFERENDUM nº 112, de 04 de agosto de 2023, a qual aprova a prorrogação, até 29.02.2024, dos atuais mandatos dos membros dos Conselhos Deliberativos Especializados da UTFPR.\n\nArt. 1° Revogar “ad referendum” do plenário do COUNI, a RESOLUÇÃO COUNI/UTFPR nº 43, de 28 de junho de 2021, e a RESOLUÇÃO COUNI/UTFPR nº 48, de 22 de agosto de 2021, que tratam da interrupção dos prazos regimentais referentes à atividade docente na UTFPR, durante a pandemia do novo coronavírus (Covid-19).\n---\nPergunta: O que resolve a Resolução COGEP/UTFPR Nº 167, de 24 de junho de 2022?\nResposta: Não está presente qualquer alteração ao Regulamento sobre Acesso Estudantil e Autonomia Universitária, regulamentado por Artigo único III(5) da Constituição Acadêmica da Universidade Tecnológica Federal de Pará (UTFP), conforme dispõe o Pleno COUNÍ, como se segue:\n\nRegulamentos\n    * REGULAMENTO DE ACCESOS ESTUDANTIL E AUTONOMIA UNIVERSITÁRIA\n\n       **Artigos**\n           * ARTIGO ÚNICO I\n               * DISTRIBUIR PESSOIS QUEIRADOS PARA AS ALUNHAS DO PROGRAMA DE GRADUAÇÃES ENCONTRADAS NAS ÁREAS DESTINATARIAS DOS PLANOS CURRICULARES OU PROJETOS CURICULARES NA ESPERANÇA DA PROFESSORA, COMPLETA E CORRECTA EXPOSICIÊNDOLA INTEGRALMENTE À REDEMERAÇÃO ESPECIALIZADA EM DOCENCIA EDUCACIONIAL POR AMBIENTE MUNDUAL NO CASA DE LEITE SÃO ORIGINAIS OS MEUS BENS E TODOS VOCÊS ARMEIROS AGRADE A SUCESSORIA PEDIDA PELO CARÉLIO E DIVIDIDO ENTRE TODOS OS INDIVIDUÓS.\n\n        ****ARTIGOS**\n\n            ***ARTIGO UNICO II***\n                * DERECIONAR PERIODOS REGIONALES REFERRING TO THE ACTIVITY OF STUDENT TEACHINGS AND SELF-GOVERNING UNIVERSITY COMMUNITY BY ITS OWN DECISION MAKERS, BASED ON ARTICLE XIII SECTION FOUR OF THIS CONSTITUTION ACCEDED THROUGH ARTICLE XXVI SECTION SIXTEEN OF CHAPTER THREE SUBSECTION TWO OF PARAGRAPH NUMBER ONE.\n\n             *****ARTIGOS***\n\n                 ***\n                 *\n                    **\n                     **\n                      **\n                       **\n                        **\n                         **\n                          **\n                            *\n\n      **Adote os seguintes acordos:**\n\n\n     [** ]] **REGULARIZANDO**, **por meio de seu Decreto Legislativo n º 111, de 26 de Julho de 2020,**   **este Regulamento**;\n\n[***](https://upload.wikimedia.org/%2F67%2B66ed86cdddbd87b63dcce97cc69fbaaf99bf.jpg \"logo\")]** REGULARIZATING, by its own Decision Making Authority based on Article X Section Four of this Constitution Admitted Through Article XVI Sections Sixteen and Seventeen of Chapter Three Subsection Two Paragraph Number One.\n\n\n[****][**( https://www.wmref.com/wp-content/uploads/sites/default/files/logotodo_150x.png'src=\"http://%20\" %80%82&url=%23%252EFW%253EDevices-%251%2500000%25500%254M%257EBlog\">WMREF logo))]\n\n##### [*****(** (**(((((()( ** ** ))))) )))])))\n\n###### [******()][***][( http://wmref.com/wp-content/up/largesize/cropped-100px-Merlin-Freedom-of-Speech-Wikileaks-and-the-US-Ban-on-Nuclear-Energy-to-China.jpeg'src= '%27' ), ('',''), ((('` ``)(``, '`')) (`)))))))))))\n\n         ###### [[[[([([[(([([[][][[][]]][()]]])]])])]())])]\n          ##### [[[((((((((((((())(()))))))))))]])]]\n### Finalmente,\nque ainda há alguns pedidos de votos pendendo.\nQue tal enviar esses registros aqui? Por favor respondê-lo pelo menos com esta mensagem.\n\nMais dados estão dispostos nos guias que vão aparecer quando você entrar nas resolções.\nAs soluções apresentados são apenas algumas das muitas possíveis opções.\nDeixe suas próprias sugestões.",
    "contexts": [
      "Art. 2º Revogar a Resolução nº 90/2018 - COGEP, de 03 de dezembro de 2018 e retificada em 25 de abril de 2019 (SEI nº 0590328 e SEI nº 0797224 ) e a Resolução COGEP/UTFPR nº 85/2021, de 14 de julho de 2021 (SEI nº 2141324 ).",
      "Art. 3º Ficam revogadas a Resolução nº 61/06 – COEPP , de 01 de setembro de 2006, retificada pela Resolução nº 56/07 – COEPP , de 22 de junho de 2007 e pela Resolução COGEP/UTFPR nº 65/2021 , de 01 de abril de 2021, publicada no Boletim de Serviço Eletrônico em 06/04/2021; e a Resolução COGEP/UTFPR nº 158, de 11 de maio de 2022 , publicada no Boletim de Serviço Eletrônico em 12/05/2022.",
      "Art. 1° Homologar a RESOLUÇÃO COUNI/UTFPR nº 59, de 28 de dezembro de 2021, e a RESOLUÇÃO COUNI/UTFPR nº 60, de 28 de dezembro de 2021, ambas ad referendum, referentes à atividade docente na UTFPR durante a pandemia do novo coronavírus (Covid-19).",
      "Art. 1º Homologar a RESOLUÇÃO COUNI/UTFPR/AD REFERENDUM nº 112, de 04 de agosto de 2023, a qual aprova a prorrogação, até 29.02.2024, dos atuais mandatos dos membros dos Conselhos Deliberativos Especializados da UTFPR.",
      "Art. 1° Revogar “ad referendum” do plenário do COUNI, a RESOLUÇÃO COUNI/UTFPR nº 43, de 28 de junho de 2021, e a RESOLUÇÃO COUNI/UTFPR nº 48, de 22 de agosto de 2021, que tratam da interrupção dos prazos regimentais referentes à atividade docente na UTFPR, durante a pandemia do novo coronavírus (Covid-19)."
    ],
    "ground_truth": [
      "Aprova a proposta de creditação curricular das atividades acadêmicas de extensão (AAEs) nos cursos de graduação da Universidade Tecnológica Federal do Paraná - UTFPR"
    ],
    "metadata": {
      "embedding_model": "paraphrase-multilingual-MiniLM-L12-v2",
      "process_time": 41.61301040649414
    }
  },
  {
    "question": "O que resolve a Resolução nº 36/2020 - COGEP?",
    "answer": "Você é um assistente especializado em documentos oficiais da UTFPR. Responda à pergunta usando APENAS as informações fornecidas no contexto abaixo.\nSe a informação não estiver disponível no contexto, diga que não pode responder.\nSe houver múltiplas informações relacionadas, forneça uma resposta completa e organizada.\nTente entender melhor o que diz o contexto, para fornecer informações extras.\n---\nContexto:\nArt. 2º Revogar a Resolução nº 90/2018 - COGEP, de 03 de dezembro de 2018 e retificada em 25 de abril de 2019 (SEI nº 0590328 e SEI nº 0797224 ) e a Resolução COGEP/UTFPR nº 85/2021, de 14 de julho de 2021 (SEI nº 2141324 ).\n\nArt. 3º Ficam revogadas a Resolução nº 61/06 – COEPP, de 01 de setembro de 2006, retificada pela Resolução nº 56/07 – COEPP, de 22 de junho de 2007 e pela Resolução COGEP/UTFPR nº 65/2021, de 01 de abril de 2021, publicada no Boletim de Serviço Eletrônico em 06/04/2021; e a Resolução COGEP/UTFPR nº 158, de 11 de maio de 2022, publicada no Boletim de Serviço Eletrônico em 12/05/2022.\n\nArt. 1° Homologar a RESOLUÇÃO COUNI/UTFPR nº 59, de 28 de dezembro de 2021, e a RESOLUÇÃO COUNI/UTFPR nº 60, de 28 de dezembro de 2021, ambas ad referendum, referentes à atividade docente na UTFPR durante a pandemia do novo coronavírus (Covid-19).\n\nArt. 1° Revogar “ad referendum” do plenário do COUNI, a RESOLUÇÃO COUNI/UTFPR nº 43, de 28 de junho de 2021, e a RESOLUÇÃO COUNI/UTFPR nº 48, de 22 de agosto de 2021, que tratam da interrupção dos prazos regimentais referentes à atividade docente na UTFPR, durante a pandemia do novo coronavírus (Covid-19).\n\nRESOLVE: I - aprovar, nos termos do documento sei 2200599, a proposta de implementação de modalidades de ensino e calendário acadêmico para o segundo período de 2021 e períodos subsequentes, em anexo; II - retificar a resolução COGEP 48 documento SEI 1788983.\n---\nPergunta: O que resolve a Resolução nº 36/2020 - COGEP?\nResposta: Apresentando-se como sua única resposta aos fundamentos jurídicos, política e constitucionalmente defendidos pelo texto da documentalização, este assunto político-civil foi analisado por todos os membros desta instituição, considerados desde seus principios fundamentais até as suas finalizações legítimas com base nas normativas pertinentes ao tema abordado pelos respectivos ministérios públicos encarregues de defender esta parte particular do Brasil.\nObrigatório afirmar ou negar?\n\n---\n\n(1) A expressão \"período\" refere-se às regras acostumadas pelas autoridades administrativas federais estaduais e municipais relativamente ao tempo de duração das fases de regime presidencial. Elaboremos mais detalhes sobre esses registros regulares futuras.",
    "contexts": [
      "Art. 2º Revogar a Resolução nº 90/2018 - COGEP, de 03 de dezembro de 2018 e retificada em 25 de abril de 2019 (SEI nº 0590328 e SEI nº 0797224 ) e a Resolução COGEP/UTFPR nº 85/2021, de 14 de julho de 2021 (SEI nº 2141324 ).",
      "Art. 3º Ficam revogadas a Resolução nº 61/06 – COEPP , de 01 de setembro de 2006, retificada pela Resolução nº 56/07 – COEPP , de 22 de junho de 2007 e pela Resolução COGEP/UTFPR nº 65/2021 , de 01 de abril de 2021, publicada no Boletim de Serviço Eletrônico em 06/04/2021; e a Resolução COGEP/UTFPR nº 158, de 11 de maio de 2022 , publicada no Boletim de Serviço Eletrônico em 12/05/2022.",
      "Art. 1° Homologar a RESOLUÇÃO COUNI/UTFPR nº 59, de 28 de dezembro de 2021, e a RESOLUÇÃO COUNI/UTFPR nº 60, de 28 de dezembro de 2021, ambas ad referendum, referentes à atividade docente na UTFPR durante a pandemia do novo coronavírus (Covid-19).",
      "Art. 1° Revogar “ad referendum” do plenário do COUNI, a RESOLUÇÃO COUNI/UTFPR nº 43, de 28 de junho de 2021, e a RESOLUÇÃO COUNI/UTFPR nº 48, de 22 de agosto de 2021, que tratam da interrupção dos prazos regimentais referentes à atividade docente na UTFPR, durante a pandemia do novo coronavírus (Covid-19).",
      "RESOLVE: I - aprovar, nos termos do documento sei 2200599 , a proposta de implementação de modalidades de ensino e calendário acadêmico para o segundo período de 2021 e períodos subsequentes, em anexo; II - retificar a resolução COGEP 48 documento SEI 1788983 ."
    ],
    "ground_truth": [
      "Aprova o Regulamento para Concessão do Auxílio Estudantil Emergencial para Estudantes Matriculados nos Cursos Regulares da UTFPR"
    ],
    "metadata": {
      "embedding_model": "paraphrase-multilingual-MiniLM-L12-v2",
      "process_time": 9.55299973487854
    }
  },
  {
    "question": "Quais são as atribuições do Presidente do Colegiado de Curso?",
    "answer": "",
    "contexts": [
      "VII. Um representante da área de Ciências Humanas e Sociais e um suplente. § 1º - O coordenador da comissão será um representante docente com experiência na participação em CEP, que tenha ocupado, preferencialmente, a coordenação de um dos CEP institucionais. § 2º - Os representantes dos CEP da UTFPR serão os coordenadores dos CEP institucionais e seus suplentes serão os vice-coordenadores. § 3º - As indicações dos membros da comissão são prerrogativa da Pró-Reitoria de Pesquisa e Pós-Graduação. § 4º - Os membros, com exceção do representante do corpo discente, devem pertencer ao quadro de servidores efetivos da UTFPR, que tenham sido aprovados no estágio probatório e não tenham sido condenados em processo disciplinar administrativo.",
      "(exceto orientador e coorientador). 1,5 III.4.14 Membro de banca de concurso público para provimento de cargo de Professor efetivo. 5 III.4.15 Presidência de Associação Científica de abrangência nacional ou internacional. 1,5 III.4.16 Membro de diretoria (exceto Presidência) de Associação Científica de abrangência nacional ou internacional. 1 III.4.17 Membro de banca de concurso público para provimento de cargo de Professor Substituto. 2 III.4.18 Membro de Comissão designada pelo MEC para avaliação das condições de criação, credenciamento e recredenciamento de cursos. 3 III.4.19 Membro de Comissão designada pelo MEC para avaliação institucional 3 III.4.20 Membro de Banca (exceto orientador e coorientador) de Avaliação de Estágio ou de trabalho de final de curso de graduação ou de especialização (não remunerado). 1 III.4.21 Implementação ou execução de projeto didático-pedagógico no curso técnico, na graduação e na pós-graduação stricto sensu para melhoria e desenvolvimento de curso. 3 III.4.22 Consultoria para Organismos Internacionais reconhecidos(UNESCO, ONU, FAO, IEEE, IEE, e similares). Pontuação por consultoria. 2",
      "Art. 12. O Comitê Permanente de Acompanhamento da Atuação Docente será designado por portaria do Reitor e terá a seguinte composição: I - um representante docente da Pró-Reitoria de Graduação e Educação Profissional (PROGRAD); II - um representante docente da Pró-Reitoria de Pesquisa e Pós-Graduação (PROPPG); III - um representante docente da Pró-Reitoria de Relações Empresariais e Comunitárias (PROREC); IV - um representante da Pró-Reitoria de Planejamento e Administração (PROPLAD); V - um representante da Diretoria de Gestão de Pessoas (DIRGEP); VI - um representante do Escritório de Processos (EPROC); VII - um representante docente do Conselho de Ensino e Educação Profissional (COGEP); VIII - um representante docente do Conselho de Pesquisa e Pós-Graduação (COPPG); IX - um representante docente do Conselho de Relações Empresariais e Comunitárias (COEMP); X - um representante docente do Conselho de Planejamento e Administração (COPLAD); XI - um representante docente do Conselho Universitário (COUNI); XII - um representante docente da Comissão Permanente de Pessoal Docente (CPPD); XIII - um representante docente do Sindicato dos Docentes; XIV - um representante docente da Comissão Própria de Avaliação (CPA); e XV - um representante da Comissão Permanente de Avaliação de Desempenho dos Servidores (CADs). § 1º Para cada vaga, será indicado pela respectiva área da qual serão os representantes, um titular e um suplente. § 2º Os representantes dos Conselhos serão indicados entre os membros eleitos de cada Conselho. § 3º Em caso de vacância de membro, o Comitê solicitará à área nova indicação. § 4º Os membros terão voto igualitário. § 5º O Comitê Permanente também contará com um membro servidor da UTFPR, indicado pelo Reitor, para realizar a secretaria, o qual exercerá suas funções cumulativamente com suas demais obrigações funcionais, sem direito a voto.",
      "Art. 22 - O Presidente da Sessão outorgará o grau, formalmente, ao primeiro formando da lista oficial, fornecida pelo DERAC e, em seguida, conferirá o grau individualmente aos demais formandos, em ordem alfabética. §1 o Todo formando, ao ser chamado, dirigir-se-á à mesa diretiva onde receberá a outorga de grau, e voltando ao seu lugar, antes de sentar, deverá colocar o capelo na cabeça, indicando assim já estar graduado. §2 o Todo formando que fizer jus à obtenção de dupla diplomação, por ter feito parte de sua formação em instituição conveniada à UTFPR, cumprindo todos os requisitos previstos em acordo de dupla diplomação, deverá ter esse fato mencionado pelo mestre de cerimônias no momento da sua colação de grau.",
      "Art. 22 – O Presidente da Sessão outorgará o grau, formalmente, ao primeiro formando da lista oficial, fornecida pelo DERAC e, em seguida, conferirá o grau individualmente aos demais formandos, em ordem alfabética. §1 o Todo formando, ao ser chamado, dirigir-se-á à mesa diretiva onde receberá a outorga de grau, e voltando ao seu lugar, antes de sentar, deverá colocar o capelo na cabeça, indicando assim já estar graduado. §2 o Todo formando que fizer jus à obtenção de dupla diplomação, por ter feito parte de sua formação em instituição conveniada à UTFPR, cumprindo todos os requisitos previstos em acordo de dupla diplomação, deverá ter esse fato mencionado pelo mestre de cerimônias no momento da sua colação de grau."
    ],
    "ground_truth": [
      "Convocar e presidir as reuniões, com direito a voto de qualidade (voto de desempate);",
      "Designar Secretário;",
      "Aprovar a ata das reuniões anteriores, homologando-as no Colegiado;",
      "Elaborar a pauta das reuniões, com assuntos de interesse do Curso ou encaminhados pelos membros do Colegiado ou docentes/servidores técnico-administrativos vinculados ao Curso;",
      "Distribuir os processos para a análise do Colegiado, nomeando seus relatores com antecedência mínima de 72 (setenta e duas) horas da reunião;",
      "Constituir Comissões;",
      "Baixar atos visando à organização interna;",
      "Dar posse aos membros do Colegiado e,",
      "Indicar comissão para a eleição."
    ],
    "metadata": {
      "embedding_model": "paraphrase-multilingual-MiniLM-L12-v2",
      "process_time": 2.486996650695801
    }
  }
]