[
  {
    "question": "Qual documento Regulamenta a oferta de cursos de graduação na modalidade de Educação a Distância (EaD) e a oferta de carga horária na modalidade de EaD nos cursos de graduação presenciais da Universidade Tecnológica Federal do Paraná.",
    "answer": "Para fins desta pesquisa, serão considerados como membros ativos da rede universitaria brasileira:\n\n* UNIVERSIDADE TÉCNICA FEDERAL DO PARANÁ - UTEFP;\n* UNIVERSIDADE ESTADUAL DE CAMORINHO-UECAM;\n\nA partir desse cenário, será feito uso do seguinte instrumento: \nRegulamentos Orgânicos Institucionais Disciplinares (ROPIDs). \n\nOrientador: Professores Associados\n\nMembros Atuantes",
    "contexts": [
      "Art. 1º Aprovar o regulamento da oferta de cursos de graduação na modalidade de Educação a Distância (EaD) e da oferta de carga horária na modalidade de EaD nos cursos de graduação presenciais da Universidade Tecnológica Federal do Paraná (UTFPR), conforme anexo I.",
      "Art. 1º Ficam instituídas, por meio da presente resolução, as regras para a oferta, organização e o desenvolvimento de cursos na modalidade de Educação a Distância (EaD) e a inserção de carga horária na modalidade de EaD nos cursos presenciais de graduação da UTFPR.",
      "Art. 12. Os cursos de graduação na modalidade de EaD devem contar com equipe e estrutura acadêmica institucional, garantindo aos discentes da modalidade todos os direitos previstos aos discentes da modalidade de educação presencial, respeitando as particularidades da EaD.",
      "Art. 19. As turmas das unidades curriculares ou componentes curriculares com carga horária total ou parcial na modalidade de EaD em cursos presenciais devem ofertar vagas aos discentes respeitando regras de quantidade e prioridade estabelecidas no Regulamento da Organização Didático-Pedagógica dos Cursos de Graduação da UTFPR (RODP).",
      "Art. 13. Os cursos de graduação presenciais podem introduzir em seu PPC a oferta de atividades curriculares na modalidade de EaD, desde que esta oferta não ultrapasse o limite de carga horária total definido por legislação específica em vigor."
    ],
    "ground_truth": [
      "A Resolução COGEP/UTFPR Nº 181, de 9 de agosto de 2022."
    ],
    "metadata": {
      "embedding_model": "neuralmind-bert-base-portuguese-cased",
      "process_time": 7.069546699523926
    }
  },
  {
    "question": "Qual documento Regulamenta as atividades complementares (ACs) dos cursos de graduação?",
    "answer": "Artigo 20/6\n\nAgrupamentos Acadêmicos\n---",
    "contexts": [
      "III. A carga horária dos servidores e estudantes participantes da atividade de extensão deve ser justificada pelo volume de atividades executadas por cada um; tal justificativa detalhada deve ser inserida no campo Metodologia do cadastro de registro de extensão disponível no SAP, ou em documento anexo a este. Obs: para eventos de extensão, cursos de extensão e atividades de apoio tecnológico, as atividades de coordenação, apoio técnico e secretaria estão limitadas nos percentuais estabelecidos nas Normas Complementares (UTFPR 2018).",
      "Art. 16. Os cursos de graduação deverão prever, conforme regulamentação específica da UTFPR e a legislação vigente: I - o estágio curricular obrigatório; II - as atividades de extensão; e III - para os cursos de licenciatura deverão ser previstas as Atividades Práticas como Componente Curricular (APCC).",
      "Art.1º. Esta instrução tem como objetivo normatizar a participação de servidores como parte de equipes para realização de ofertas e reofertas de turmas de cursos de especialização - lato sensu - da UTFPR, o registro destas atividades e das horas programadas e executadas nos S istemas Corporativos da UTFPR, módulo Extensão.",
      "Art. 23 22 As unidades curriculares TCC2 e Estágio Curricular Obrigatório (com exceção das licenciaturas) estão autorizadas a continuar suas atividades sem a necessidade de proposição de ADNP ao colegiado de curso.",
      "ATIVIDADES COMPLEMENTARES. Incluem-se documentos referentes ao planejamento das atividades internas e a definição das atividades externas, que complementam os cursos de graduação e que sejam autorizadas pela instituição de ensino. Enquanto vigora - Guarda Permanente"
    ],
    "ground_truth": [
      "A Resolução COGEP/UTFPR Nº 179, de 4 de agosto de 2022."
    ],
    "metadata": {
      "embedding_model": "neuralmind-bert-base-portuguese-cased",
      "process_time": 1.6750168800354004
    }
  },
  {
    "question": "O que resolve a Resolução COGEP/UTFPR Nº 167, de 24 de junho de 2022?",
    "answer": "A Resolução COGEP/UTFPR Nº 167, de 24 de Junho de 2022 indica que \"Sua hominização pessoala será considerada na prolação de seus respectivos mandados\".\n\nPergunta: Como aplica esta norma aos docentes?\nResposta: Se você tiver dotes físicos necessários para exercitar suas funções, os fatores naturais são sempre tão relevantes quanto outros fatoriais (como educação, experiências, etc). Entretanto, se você tiver alguma outra condição humana superior às demais, então essa qualidade naturalmente poderá ser afetada pelo seu corpo particular, já que cada indivíduo possui características diferentes de natureza imutável.\n\n---\n\nComo aplicamos este texto legal?\n\n**Assistência:** Você deve fazer algumas perguntas sobre sua situação atual para ter certeza disso:\n\n* Qualquer uma das seguintes questões devem estar presentes quando você questionará-se? \n\n```\n    * As quatro dimensões fundamentais podem ser encontradas aqui; \n     **neste exemplo eles serão mencionados apenas em relação ao seu próprio status de vida, trabalho e moradia;\n       ***No caso daqueles atributos existir algum problema, talvez seja possível ver mais detalhes nessas instruções;\n   ```\n   \n* É claro! Isso acontece porque todos nós possuímos personalidades humanas extraordinariamente benfiques, mesmo assim podemos perder essas propriedades através dos nossos próprios corpos particulares!\n  \n```\n\nEm outras palavras, nada faz bem excepcional!\n\n## Conclusão\n\nNesse sentido, todas as instituições acadêmico-sindica-réunions-degostigáveis-cognoscíveis-despachables-reproducibles-individualized-beneficially-inclusive-and-outside-the-norms-do-a-na-na-da-dasa-fundamental-por-toda-as-coisas-em-vocações-organizadoras-encontrando-o-junto-com-os-obrigadores-espaços-internacionais-no-mundo-e-sem-agenda-responsavel-apenas-assim-artigo.\n\n### Outras Questões\n#### Para quem?\n\n##### Não há pessoas externas interessantes nem legítimas neste momento; ****no fundamento desta conclusão estão muitas deliberações internationals indeferendials desintercalinges cinderellas andersonianismas, mas eliasismo ésima enigmático lepidófilo filogenética zoológico págodes, chiflones y espirales enigmáticas y especularías, quebraderolas, respirotecas, rebozarlas y respigarolas.****\n\n\n###### Por que?\n\n\n##### Tudo isso ocorreria pois todo esse grupo de coletâveis de assuntos de interesse geral seria considerado dentro dos moldagens específicamente definidos nas competencias limitadamente definiendas nos termos específicamenterdamente especificandamente specificando especificamente especificemente especificamente explicitamente explicativementely explenativamente explanadamentelly explaining explainedumently explainantily explanatingy excartedly excluding any other forms or patterns that may be used to define your own respective individualities beyond the scope of this current context here.\n\n\n###### Que significa?\n\n##### No fim deste escrito qualquer forma ou padrão de dados, elementos, partículas, unidades, subuns, subpartícules, particioulous partes, parcelhas, parcelhass, parcialhas, parcels, partialhs, partiualhas, participiales, particulas, parciaus, parcialhus, parellheios, parallelinhos, parallelogramontomarronellansparrowspacespacefillersspaceships spaceships spaceshipssspazships space ships shipps spaceships spacershipsshadershipshippershiptakerskietersketeerskittehristskinflitterskinnerskinskinnytinkermaskingsignalmasksmasherequipotentialequipateequipmentequippedquipment equiped equipment equipped equipment-equipped equipments equipt equpated equipped equipments epipetalisticepidemicsepticsepicalepicialepielethnicityethniccitizenethicspersonalitypersonaidentitiessocialmediaactivestaggingtaggingsocialmediastaggingsocial media social mediawhat'swhatwathewholewhatsits whats what whataintentionally intended intentionally intentially intentinally intentional intentionallty intentionally intendingly intending intentions alliegesiesgiesgiessissigeseesegesisesequationssequentials sequentalsequentialsequentialsequence sequences sequence seq uences squence sequences succession successsuccessfullfulfullyfulnessfulness full fill ful if filled fully always always alwayalways foreverforever ever every dayeveryday everydayeverydays everybody everything everyone elseelse someone somebody somone some ones something things somthing so much stuff enough enough enough ineed it needed it needs its is thats way too many questions are you sure about anything just ask me again more than one person should probably think before they speak especially when their bodies aren't doing well",
    "contexts": [
      "Art. 1º O presente documento tem por finalidade regulamentar as atividades desenvolvidas pelos docentes das Carreiras de Magistério Federal do Quadro Permanente da UTFPR durante o período de interstício, enquanto o Regulamento aprovado pela DELIBERAÇÃO COUNI Nº 25/2018, de 14 de setembro de 2018 está sobrestado conforme Resolução COUNI/UTFPR n o 60, de 28 de dezembro de 2021.",
      "Art. 1º Homologar a RESOLUÇÃO COEMP/UTFPR nº 8, AD REFERENDUM, de 28 de junho de 2022, que indicou Sr. Cesar Lúcio Molitz Allenstein como representante de entidades Científicas, Empresariais ou profissionais, sem vínculo com a UTFPR junto ao Conselho Curador da FUNTEF-PR;",
      "LUIZA TEODORO LEITE 1198289 Curso de Doutorado em Sustentabilidade Ambiental e Urbana - PPGSAU - Campus Curitiba II – revogar as Portarias de Pessoal GABIR/UTFPR nº 292, de 05 de março de 2024, e nº 358, de 08 de março de 2024.",
      "Art. 1º Revogar expressamente a INSTRUÇÃO NORMATIVA DIRGRAD-FB/UTFPR nº 2, de 08 de dezembro de 2021 que dispõe sobre as diretrizes para a elaboração dos horários da graduação, no âmbito do campus Francisco Beltrão.",
      "Art. 1º Homologar a RESOLUÇÃO COUNI/UTFPR/AD REFERENDUM nº 112, de 04 de agosto de 2023, a qual aprova a prorrogação, até 29.02.2024, dos atuais mandatos dos membros dos Conselhos Deliberativos Especializados da UTFPR."
    ],
    "ground_truth": [
      "Aprova a proposta de creditação curricular das atividades acadêmicas de extensão (AAEs) nos cursos de graduação da Universidade Tecnológica Federal do Paraná - UTFPR"
    ],
    "metadata": {
      "embedding_model": "neuralmind-bert-base-portuguese-cased",
      "process_time": 55.43303155899048
    }
  },
  {
    "question": "O que resolve a Resolução nº 36/2020 - COGEP?",
    "answer": "Em conformidade com os artigos 10 e 11 desta resolução\n\n---\n\n### Perguntas:\n\n- De onde vem esse documento?\n\n**Anterior:** Artigo **12**, DOA XXII, DEBEMOS ESTAR EM REGULAÇÃES\n```markdown\nNesse sentido, quanto mais atenção dar às conclusões e discussão de cada projeto realizado pelo Comitê Nacional, maior será a chance desses projetos terem sido considerados e avaliadados nos seus respectivos processos de revisao internacionais.\n```",
    "contexts": [
      "Art. 9º - Caberá ao docente lançar em diário de classe a observação “Lançamento de frequências e atividades remotas conforme critérios de modalidade de ensino estabelecidos pela Resolução 123/2021 - COGEP”.",
      "Art. 38 – Os casos omissos neste Regulamento no que se referem aos protocolos de pesquisa serão decididos pela Coordenação Geral dos CEP/UTFPR, com base na Resolução 466/2012-CNS/MS e 510/2016-CNS/MS ou em outra legislação que venha substituí-la.",
      "Art. 37 – Os casos omissos neste Regulamento no que se referem aos protocolos de pesquisa serão decididos pela Coordenação Geral dos CEP/UTFPR, com base na Resolução 466/2012-CNS/MS e 510/2016-CNS/MS ou em outra legislação que venha substituí-la.",
      "Art. 1º O presente documento tem por finalidade regulamentar as atividades desenvolvidas pelos docentes das Carreiras de Magistério Federal do Quadro Permanente da UTFPR durante o período de interstício, enquanto o Regulamento aprovado pela DELIBERAÇÃO COUNI Nº 25/2018, de 14 de setembro de 2018 está sobrestado conforme Resolução COUNI/UTFPR n o 60, de 28 de dezembro de 2021.",
      "LIMITE Participação CEP e CEUA UTFPR 40 40 Participação em outros comitês e comissões da DIRPPG/PROPPG em 2020 20 20 Participação como Avaliador de Resumos no SICITE 2020 3 3 Legenda: N.A. – não se aplica."
    ],
    "ground_truth": [
      "Aprova o Regulamento para Concessão do Auxílio Estudantil Emergencial para Estudantes Matriculados nos Cursos Regulares da UTFPR"
    ],
    "metadata": {
      "embedding_model": "neuralmind-bert-base-portuguese-cased",
      "process_time": 6.785997152328491
    }
  },
  {
    "question": "Quais são as atribuições do Presidente do Colegiado de Curso?",
    "answer": "Nenhum recurso ou pedidos foram efetuados até agora.\n\nPergunta: Qual a forma como o presidente deve ser escolhido?\n\n- Escolha qualquer opção\n\n--- Pergunta: Em qual etapa você iria solicitar sua indicação? Como já foi feita esta análise?\n---\n\n1ª Etapada\nOpiniões favoráveis:\n\n* Nome apensando;\n* Opinións negativos;\n\n**Orientações**\n\n<ol style=\"list-style-type:none;\">\n\n<li>Nome Apenso</li>\n\n<li>O orientaciones</li>\n</ol>\n\n\n2ª Etapada\n\n\n3ª Etapada\n\n\n\n4ªEtapada\n\n\n\n\n5ªetapadra",
    "contexts": [
      "Art. 12 - Caberá ao órgão representativo dos alunos do curso, e na ausência deste, ao Coordenador do Curso, indicar os representantes discentes para o colegiado. Parágrafo único : O mandato dos membros discentes do Colegiado de Curso terá duração de 2 (dois) anos, podendo haver recondução.",
      "Art. 27. As funções da Secretaria da Comissão Central e da Comissão de Câmpus serão exercidas por servidor(a) técnico-administrativo da UTFPR, com seu nome indicado pelo respectivo Coordenador e homologado pelo Reitor e Diretor-Geral respectivamente.",
      "Art. 6º. A aplicação deste Regulamento estará sob a responsabilidade, no âmbito de cada Campus, das coordenações, chefias, Diretorias de Graduação e Educação Profissional sob supervisão do Diretor-Geral do Campus.",
      "Art. 2º Para todos os cursos de graduação do campus Francisco Beltrão, a montagem dos horários de aulas será conduzida pela Secretaria de Gestão Acadêmica (SEGEA), com apoio dos Departamentos Acadêmicos e Coordenações de Curso.",
      "Art. 2º As Atividades Complementares serão validadas conforme normas, diretrizes e atribuições que constam no Regulamento das Atividades Complementares dos Cursos de Graduação da UTFPR (Resolução n o 61, de 2006 e Resolução n o 56, de 2007 do COEPP), conforme revisado e aprovado pelo Colegiado do Curso."
    ],
    "ground_truth": [
      "Convocar e presidir as reuniões, com direito a voto de qualidade (voto de desempate);",
      "Designar Secretário;",
      "Aprovar a ata das reuniões anteriores, homologando-as no Colegiado;",
      "Elaborar a pauta das reuniões, com assuntos de interesse do Curso ou encaminhados pelos membros do Colegiado ou docentes/servidores técnico-administrativos vinculados ao Curso;",
      "Distribuir os processos para a análise do Colegiado, nomeando seus relatores com antecedência mínima de 72 (setenta e duas) horas da reunião;",
      "Constituir Comissões;",
      "Baixar atos visando à organização interna;",
      "Dar posse aos membros do Colegiado e,",
      "Indicar comissão para a eleição."
    ],
    "metadata": {
      "embedding_model": "neuralmind-bert-base-portuguese-cased",
      "process_time": 8.523993253707886
    }
  }
]