[
  {
    "question": "Qual documento Regulamenta a oferta de cursos de graduação na modalidade de Educação a Distância (EaD) e a oferta de carga horária na modalidade de EaD nos cursos de graduação presenciais da Universidade Tecnológica Federal do Paraná.",
    "answer": "Você é um assistente especializado em documentos oficiais da UTFPR. Responda à pergunta usando APENAS as informações fornecidas no contexto abaixo.\nSe a informação não estiver disponível no contexto, diga que não pode responder.\nSe houver múltiplas informações relacionadas, forneça uma resposta completa e organizada.\nTente entender melhor o que diz o contexto, para fornecer informações extras.\n---\nContexto:\nArt. 1º Aprovar o regulamento da oferta de cursos de graduação na modalidade de Educação a Distância (EaD) e da oferta de carga horária na modalidade de EaD nos cursos de graduação presenciais da Universidade Tecnológica Federal do Paraná (UTFPR), conforme anexo I.\n\nArt. 2º. Instituir a Política de Licenciamento das versões finais dos Trabalhos de Conclusão de Cursos de Graduação (TCC) e de Programas de Pós-Graduação Stricto Sensu - mestrados (dissertações) e doutorados (teses) - bem como dos produtos educacionais e tecnológicos a elas vinculados, produzidas nos cursos de Graduação e de Pós-Graduação da Universidade Tecnológica Federal do Paraná (UTFPR).\n\nArt. 2º Aprovar a Política de licenciamento das versões finais dos Trabalhos de Conclusão de Cursos (TCC) da Graduação e da Pós-Graduação Lato e Stricto Sensu (dissertações e teses), bem como dos produtos educacionais e tecnológicos a elas vinculados, produzidos no âmbito da Universidade Tecnológica Federal do Paraná;\n\nArt. 1º Esta Resolução estabelece a Política de licenciamento das versões finais dos Trabalhos de Conclusão de Curso (TCC) da Graduação e da Pós-Graduação Lato e Stricto Sensu (dissertações e teses), bem como dos produtos educacionais e tecnológicos a elas vinculados, produzidos no âmbito da Universidade Tecnológica Federal do Paraná.\n\nPROGRAMA DE AUXÍLIO À DUPLA DIPLOMAÇÃO NILO PEÇANHA O Pró-Reitor de Graduação e Educação Profissional (PROGRAD) e o Assessor de Assuntos Estudantis (ASSAE) da UNIVERSIDADE TECNOLÓGICA FEDERAL DO PARANÁ (UTFPR), no uso de suas atribuições estatutárias e regimentais e, tendo em vista o Programa de Dupla Diplomação da UTFPR, tornam público a alocação dos recursos destinados a Auxílio Financeiro para estudantes de graduação selecionados como participantes de acordos Dupla Diplomação da UTFPR. O presente Edital e demais informações relativas encontram-se publicados no seguinte endereço eletrônico: http://portal.utfpr.edu.br/editais. O Programa de Auxílio à Dupla Diplomação Nilo Peçanha é assim chamado, pois durante seu período na presidência da República, Nilo Peçanha tomou a iniciativa de criar as Escolas de Aprendizes e Artífices, precursoras dos atuais Centros Federal de Educação Tecnológica (CEFETs), que se transformou em Universidade Tecnológica Federal do Paraná, sendo o ex-presidente o patrono da educação profissional e tecnológica no Brasil, por meio da Lei 12.417/2011.\n---\nPergunta: Qual documento Regulamenta a oferta de cursos de graduação na modalidade de Educação a Distância (EaD) e a oferta de carga horária na modalidade de EaD nos cursos de graduação presenciais da Universidade Tecnológica Federal do Paraná.\nResposta: artigo original\n\n```\n<text>\nO respectivo Decreto foi assinado pelo Presidente da República, com base no art. 144° da Constituição Federal de\n1988, ao qual data de 29 de Agosto de 1993, quando da sua promulgacao pelo então Procurador Geral de Justiça,\nRaimundo Teixeira Júnior – também conhecido por Ratinho Borges -, que fez jus às exigências daqueles prefeitos cívicos,\nsendo considerado por eles como os primeiros pioneiros da digitalização judicial, cuja proposta vem sendo \nempreendida pela Assembleia Nacional Constituinte Pluripotencialmente, talvez seja mais conveniente dizer, que será\nfamiliarizada nessa ocasião com o espelho da lei, em virtude do caráter constitucionalista desses trabalhos jurídicos.\n\nProgramar oficial de duplo diplomação nas universidades federais brasileiras, portanto é essencial reconhecer essa política.\nPorém, sem esse plano instituído há muitas dúvidas sobre quase nada, nem mesmo a ressalta expressiva dos professores da\nprofundidade do curso, nem sequer saber se estão presentes ou ausentes desta conferência mundial de diplomacia.\nAs questões aqui abarcadas são muito específicas quanto aos requisitos necessários para que tais eventos ocorram.\nPortanto, este trabalho teve como objetivo ser fundamentalizar todos aqueles interessados na formatura acadêmica;\ntendo sido apontado pelos colegialistas responsáveis pelas atividades culturísticas, políticas públicas e econômicas,\nnos seus vistosos rolamentos, para dar conta deste desenho rascunhado.\n\n\nPrograma de Assistêncio à Duplade Diplomática Nilopexança\n\n\nEdição Original:\n\n<br><br>\n\n**RESUMENDO**\n\n<p>Apresentamos esta edição autoral e editada pela UniÂnia Tecnolôgica Federal do Par\r Ânaro, com objeto\r de destacar o desenvolvimento de novas práticas doumentário enunciando\r elementos centrais da regra disciplinar proclamação\r pública \r destaque; definienda definicienda definicondefinitional\r decisione declare decision declaration declarations declaring declarations declared declaration declaration statement</p>\n\n\n<b>Autor:</b>\nMiguel Ángel Salgado Martín <span class=\"date\">27 Jun 2020 </span>\n\n\n<cite></cite>\n\n\n<u>Capítulo:</u>\r\n<a id=\"\" name=\"\">Capítulos 01 a 03.</a>",
    "contexts": [
      "Art. 1º Aprovar o regulamento da oferta de cursos de graduação na modalidade de Educação a Distância (EaD) e da oferta de carga horária na modalidade de EaD nos cursos de graduação presenciais da Universidade Tecnológica Federal do Paraná (UTFPR), conforme anexo I.",
      "Art. 2º. Instituir a Política de Licenciamento das versões finais dos Trabalhos de Conclusão de Cursos de Graduação (TCC) e de Programas de Pós-Graduação Stricto Sensu - mestrados (dissertações) e doutorados (teses) - bem como dos produtos educacionais e tecnológicos a elas vinculados, produzidas nos cursos de Graduação e de Pós-Graduação da Universidade Tecnológica Federal do Paraná (UTFPR).",
      "Art. 2º Aprovar a Política de licenciamento das versões finais dos Trabalhos de Conclusão de Cursos (TCC) da Graduação e da Pós-Graduação Lato e Stricto Sensu (dissertações e teses), bem como dos produtos educacionais e tecnológicos a elas vinculados, produzidos no âmbito da Universidade Tecnológica Federal do Paraná;",
      "Art. 1º Esta Resolução estabelece a Política de licenciamento das versões finais dos Trabalhos de Conclusão de Curso (TCC) da Graduação e da Pós-Graduação Lato e Stricto Sensu (dissertações e teses), bem como dos produtos educacionais e tecnológicos a elas vinculados, produzidos no âmbito da Universidade Tecnológica Federal do Paraná.",
      "PROGRAMA DE AUXÍLIO À DUPLA DIPLOMAÇÃO NILO PEÇANHA O Pró-Reitor de Graduação e Educação Profissional (PROGRAD) e o Assessor de Assuntos Estudantis (ASSAE) da UNIVERSIDADE TECNOLÓGICA FEDERAL DO PARANÁ (UTFPR), no uso de suas atribuições estatutárias e regimentais e, tendo em vista o Programa de Dupla Diplomação da UTFPR, tornam público a alocação dos recursos destinados a Auxílio Financeiro para estudantes de graduação selecionados como participantes de acordos Dupla Diplomação da UTFPR. O presente Edital e demais informações relativas encontram-se publicados no seguinte endereço eletrônico: http://portal.utfpr.edu.br/editais . O Programa de Auxílio à Dupla Diplomação Nilo Peçanha é assim chamado, pois durante seu período na presidência da República, Nilo Peçanha tomou a iniciativa de criar as Escolas de Aprendizes e Artífices , precursoras dos atuais Centros Federal de Educação Tecnológica (CEFETs), que se transformou em Universidade Tecnológica Federal do Paraná, sendo o ex-presidente o patrono da educação profissional e tecnológica no Brasil, por meio da Lei 12.417/2011."
    ],
    "ground_truth": [
      "A Resolução COGEP/UTFPR Nº 181, de 9 de agosto de 2022."
    ],
    "metadata": {
      "embedding_model": "stsb-xlm-r-multilingual",
      "process_time": 29.286997318267822
    }
  },
  {
    "question": "Qual documento Regulamenta as atividades complementares (ACs) dos cursos de graduação?",
    "answer": "Artigo 5 º.",
    "contexts": [
      "Art. 21. Caberá ao colegiado do curso de graduação da UTFPR e/ou ao Conselho Departamental aprovar as unidades e/ou componentes curriculares a serem ofertados com atividades na modalidade de EaD. Parágrafo único. As unidades curriculares aprovadas com atividades na modalidade de EaD devem ser encaminhadas para análise do Conselho de Graduação e Educação Profissional (COGEP) da UTFPR.",
      "Art. 17. Os cursos de graduação poderão prever, de acordo com o estabelecido nas DCNs do curso e a legislação vigente: I - o estágio curricular não obrigatório; II - o TCC; e III - as atividades complementares.",
      "Art. 12. Cabe ao colegiado de curso de graduação da UTFPR: I - auxiliar a coordenação de curso na implantação das AAEs no PPC; II - avaliar programas e/ou projetos de extensão, vinculados às unidades curriculares extensionistas, quanto ao seu alinhamento com o PPC e emitir parecer, sempre que necessário; e III - avaliar as AAEs, propostas no PPC e emitir parecer sobre sua atualização, quando necessário.",
      "125.6 MONITORIAS. ESTÁGIOS NÃO OBRIGATÓRIOS. PROGRAMAS DE INICIAÇÃO À DOCÊNCIA Nas subdivisões deste descritor classificam-se documentos referentes às solicitações de bolsas individuais de monitorias, nas instituições de apoio e fomento ao ensino e pesquisa, aos estágios não obrigatórios e aos Programas de iniciação à docência. Para as solicitações de bolsas institucionais referentes à Pesquisa, classificar nas subdivisões dos códigos 220, 230 ou 240; para as referentes à Extensão, classificar nas subdivisões dos códigos 320, 330 ou 380; para os auxílios referentes à assistência estudantil, classificar nas subdivisões da Classe 500. 125.61",
      "ATIVIDADES COMPLEMENTARES. Incluem-se documentos referentes ao planejamento das atividades internas e a definição das atividades externas, que complementam os cursos de graduação e que sejam autorizadas pela instituição de ensino. Enquanto vigora - Guarda Permanente"
    ],
    "ground_truth": [
      "A Resolução COGEP/UTFPR Nº 179, de 4 de agosto de 2022."
    ],
    "metadata": {
      "embedding_model": "stsb-xlm-r-multilingual",
      "process_time": 1.2920167446136475
    }
  },
  {
    "question": "O que resolve a Resolução COGEP/UTFPR Nº 167, de 24 de junho de 2022?",
    "answer": "Apesar de estar assinada pela Secretaria Geral, há poucas dúvidas sobre os resultados alcançados pelas instituições que participaram deste processo académico. Por isso, este documento serve apenas como apoia técnica às resolues, já enviadas, e comprovante dessa atuação.",
    "contexts": [
      "6. DO CRONOGRAMA DA CHAMADA E DA MATRÍCULA 2a Chamada - pelo SiSU/MEC Publicação dos convocados no Portal UTFPR 20 de fevereiro de 2025 Etapa 1 - Envio da Documentação ( Requerimento de Matrícula ) 21 de fevereiro de 2025 a 26 de fevereiro de 2025 Execução das bancas de heteroidentificação 22 de fevereiro de 2025 a 24 de fevereiro de 2025 Resultado preliminar das bancas de heteroidentificação 25 de fevereiro de 2025 Período de recursos referente as bancas de heteroidentificação 26 de fevereiro de 2025 a 27 de fevereiro de 2025 Resultado das bancas de heteroidentificação 06 de março de 2025 Etapa 1 - Resultado preliminar da análise documental 10 de março de 2025 Etapa 1 - Substituição de documentos (Requerimento de Matrícula) 11 de março de 2025 a 12 de março de 2025 Resultado da Etapa 1 14 de março de 2025 Períodos para recursos referentes à análise documental da Etapa 1 17 de março de 2025 a 18 de março de 2025 Publicação do resultado final da 2a Chamada 20 de março de 2025 Etapa 2 - Segunda Chamada - Confirmação 20 de março de 2025 a 26 de março de 2025 Início das Atividades na UTFPR (recepção aos calouros) 20 e 21 de março para ingressantes do Campus Curitiba, demais campi 24 de março",
      "6. DO CRONOGRAMA DA CHAMADA E DA MATRÍCULA 2a Chamada - pelo SiSU/MEC Publicação dos convocados no Portal UTFPR 20 de fevereiro de 2025 Etapa 1 - Envio da Documentação ( Requerimento de Matrícula ) 21 de fevereiro de 2025 a 3 de março de 2025 Execução das bancas de heteroidentificação 22 de fevereiro de 2025 a 24 de fevereiro de 2025 Resultado preliminar das bancas de heteroidentificação 25 de fevereiro de 2025 Período de recursos referente as bancas de heteroidentificação 26 de fevereiro de 2025 a 27 de fevereiro de 2025 Resultado das bancas de heteroidentificação 06 de março de 2025 Etapa 1 - Resultado preliminar da análise documental 10 de março de 2025 Etapa 1 - Substituição de documentos (Requerimento de Matrícula) 11 de março de 2025 a 12 de março de 2025 Resultado da Etapa 1 14 de março de 2025 Períodos para recursos referentes à análise documental da Etapa 1 17 de março de 2025 a 18 de março de 2025 Publicação do resultado final da 2a Chamada 20 de março de 2025 Etapa 2 - Segunda Chamada - Confirmação 20 de março de 2025 a 26 de março de 2025 Início das Atividades na UTFPR (recepção aos calouros) 20 e 21 de março para ingressantes do Campus Curitiba, demais campi 24 de março",
      "6. DO CRONOGRAMA DA CHAMADA E DA MATRÍCULA 2 a Chamada - SiSU/MEC 2024/1 Publicação dos convocados (no portal da UTFPR ) 28 de fevereiro de 2024 Etapa 1 - Envio da Documentação (Requerimento de Matrícula) 29 de fevereiro a 02 de março de 2024 Etapa 1 - Resultado preliminar da análise documental 04 de março de 2024 Etapa 1 - Substituição de documentos (Requerimento de Matrícula) 05 e 06 de março de 2024 Resultado da Etapa 1 07 de março de 2024 Períodos para recursos referentes à análise documental da Etapa 1 08 e 09 de março de 2024 Publicação do resultado final da 2 a Chamada 11 de março de 2024 Etapa 2 - Segunda Chamada 12 de março de 2024 Início das Atividades Acadêmicas 14 de março de 2024",
      "13. CRONOGRAMA DE ATIVIDADES Atividade Período Período de Inscrições 19/03 a 24/03 Análise das inscrições 25/03 Divulgação do resultado preliminar 25/03 Submissão de recurso 26/03 Homologação e divulgação do resultado final 27/03 Início da vigência da bolsa Abril de 2024 Término da vigência da bolsa Março de 2025",
      "DATA/PERÍODO Inscrições 12 a 21 de junho de 2023 Análise das Inscrições 22 de junho de 2023 Resultado da Etapa 1 23 de junho de 2023 Interposição de Recurso quanto ao Resultado da Etapa 1 24 a 25 de junho de 2023 Resultado da Interposição de Recurso Etapa 1 26 de junho de 2023 Convocação para as Entrevistas 26 de junho de 2023 Realização das entrevistas 27 e 28 de junho de 2023 Resultado Final 29 de junho de 2023 Interposição de Recurso quanto ao Resultado Final 30 de junho de 2023 Resultado da Interposição de Recurso quanto ao Resultado Final 03 de julho de 2023 Convocação dos candidatos selecionados por e-mail 04 de julho de 2023 Início das atividades 19 de julho de 2023 Término das Atividades e relatório final 18 de julho de 2024"
    ],
    "ground_truth": [
      "Aprova a proposta de creditação curricular das atividades acadêmicas de extensão (AAEs) nos cursos de graduação da Universidade Tecnológica Federal do Paraná - UTFPR"
    ],
    "metadata": {
      "embedding_model": "stsb-xlm-r-multilingual",
      "process_time": 6.55500054359436
    }
  },
  {
    "question": "O que resolve a Resolução nº 36/2020 - COGEP?",
    "answer": "A resolução faz parte da série de notas de atuação com diretrizes específicas (Nota 32). No entanto,\nestá presente como pautagem única de execução. Os outros itens na mesma categoria são apresentados nos seguintes links:\n\nhttp://www.senacor.ufsc.br/publicacoes/resumens_n_34.pdf?rq=nota+33&d=-120%25;\nhttps://docs.google.com/spreadsheets/d/zjKQpBtXuYkEgFwW9eJxNqHcZnDvLsUfMmSmlO0b78/\nsheetkey/Ql0bjvnPPiBoptuORo2qprBJhnPSQpn2; https://goo.gl/h6nhLR",
    "contexts": [
      "4. CRONOGRAMA 4.1 Lançamento do Convite PROREC 01/2020 24-Jan-2020 4.2 Submissão das Propostas pelos câmpus 24 a 29-Jan-2020 4.3 Seleção da Proposta 30-Jan-2020 4.4 Divulgação do Resultado Preliminar 30-Jan-2020 4.5 Prazo para recursos Até 8:30 do dia 31-Jan-2020 4.6 Divulgação do Resultado Final 31-Jan-2020 4.7 Encaminhamento da Carta Consulta Institucional para EMBRAPII 31-Jan-2020",
      "4. CRONOGRAMA Atividade Horário Data Inscrição e Mercado de ideias até às 12h do dia 24/07/2020 29/06/2020 - 24/07/2020 Avaliação ideias até às 18h do dia 29/07/2020 27/07/2010 - 29/07/2020 Publicação dos resultados a partir das 10h 30/07/2010 Prazo de recurso até às 15h 31/07/2020 Resultado final do mercado de ideias até às 12h 31/07/2020 Imersão definido pela equipe 03/08/2020 - 21/08/2020 Avaliação propostas até às 12h até 26/08/2020 Publicação dos resultados a partir das 14h 26/08/2020 Prazo de recurso até às 15h 27/08/2020 Resultado final da imersão até às 12h 28/08/2020 Execução definido pela equipe 28/08/2020 - 20/12/2020 Demoday 14:00 - 17:00 21/12/2020 Resultado final Demoday até às 12h 22/12/2020",
      "4. CRONOGRAMA 4.1 Lançamento do Convite PROREC 01/2020 16-Nov-2020 4.2 Submissão das Propostas pelos Câmpus 23 a 27-Nov-2020 4.3 Seleção da Proposta 30-Nov-2020 4.4 Divulgação do Resultado Preliminar 01-Dez-2020 4.5 Prazo para recursos 02-Dez-2020 4.6 Divulgação do Resultado Final 03-Dez-2020 4.7 Encaminhamento da Carta Consulta Institucional para EMBRAPII 04-Dez-2020",
      "V - DATAS PARA INSCRIÇÃO, CLASSIFICAÇÃO E MATRÍCULA Período de Inscrição 03/08/2020 a 11/12/2020 Resultado Preliminar de Classificação 18/12/2020 Interposição de Recurso 19/12/2020 a 28/12/2020 Resultado Final de Classificação 31/12/2020 Período de Matrícula 04/01/2021 à 15/01/2021 Segunda chamada para matrícula 18/01/2021 à 22/01/2021",
      "4.DO CRONOGRAMA Quadro 2 - Cronograma Atividade Data/Período Publicação do Edital Até 20/03/2023 Inscrições dos(as) Candidatos(as) - Link para inscrição 21/03/2023 a 24/03/2023 Seleção e Classificação dos(as) Candidatos(as) 27/03/2023 Publicação do Resultado Preliminar Até 28/03/2023 Recurso quanto a Resultado preliminar Até 29/03/2023 Resultado dos Recursos Até 30/03/2023 Publicação do Resultado Final Até 30/03/2023 Entrega da Documentação Até 31/04/2023 Início das Atividades 01/04/2023"
    ],
    "ground_truth": [
      "Aprova o Regulamento para Concessão do Auxílio Estudantil Emergencial para Estudantes Matriculados nos Cursos Regulares da UTFPR"
    ],
    "metadata": {
      "embedding_model": "stsb-xlm-r-multilingual",
      "process_time": 12.223517894744873
    }
  },
  {
    "question": "Quais são as atribuições do Presidente do Colegiado de Curso?",
    "answer": "Você é um assistente especializado em documentos oficiais da UTFPR. Responda à pergunta usando APENAS as informações fornecidas no contexto abaixo.\nSe a informação não estiver disponível no contexto, diga que não pode responder.\nSe houver múltiplas informações relacionadas, forneça uma resposta completa e organizada.\nTente entender melhor o que diz o contexto, para fornecer informações extras.\n---\nContexto:\nI. designar os servidores abaixo relacionados, para compor o CONSELHO DE CAMPUS, do Campus Toledo da UTFPR, para o biênio 2025/2027: a) Direção-Geral: ELDER ELISANDRO SCHEMBERGER, Matrícula SIAPE n° 2114469, como titular e presidente, IVAN JOSÉ COSER, Matrícula SIAPE n° 1559136, como suplente; b) Diretoria de Graduação e Educação Profissional: IVAN JOSÉ COSER, Matrícula SIAPE n° 1559136, como titular e FELIPE WALTER DAFICO PFRIMER, Matrícula SIAPE n° 2012462, como suplente; c) Diretoria de Pesquisa e Pós-Graduação: MARIANA SBARAINI CORDEIRO, Matrícula SIAPE n° 1992458, como titular e EVANDRO ANDRE KONOPATZKI Matrícula SIAPE n° 1988861, como suplente; d) Diretoria de Planejamento e Administração: RODRIGO JOSÉ KIRSTEN, Matrícula SIAPE n° 1634763, como titular e LIS KARINA CARDOSO LUPATINI, Matrícula SIAPE n° 1946814, como suplente; e) Diretoria de Relações Empresariais e Comunitárias: SIDGLEY CAMARGO DE ANDRADE, Matrícula SIAPE n° 2579104, como titular e SUZAN KELLY BORGES PIOVESAN, Matrícula SIAPE n° 2336148, como suplente; f) Representante da Coordenação do Curso de Engenharia Civil: GUSTAVO SAVARIS, Matrícula SIAPE n° 1973112, como titular e GUILHERME ALAN SOUZA COSTA, Matrícula SIAPE n° 2222501, como suplente; g) Representante da Coordenação do Curso de Engenharia de Computação: MAURICIO ZARDO OLIVEIRA, Matrícula SIAPE n° 1426505, como titular e ALEXANDRE AUGUSTO GIRON, Matrícula SIAPE n° 2240358, como suplente; h) Representante da Coordenação do Curso de Engenharia de Bioprocessos e Biotecnologia: THIAGO CINTRA MANIGLIA, Matrícula SIAPE n° 2920808, como titular e KARINA GRAZIELLA FIAMETTI COLOMBO, Matrícula SIAPE n° 2941999, como suplente; i) Representante da Coordenação do Curso de Engenharia Eletrônica: JOSÉ DOLORES VERGARA DIETRICH, Matrícula SIAPE n° 1737729, como titular e FELIPE WALTER DAFICO PFRIMER, Matrícula SIAPE n° 2012462, como suplente; j) Representante da Coordenação do Curso de Licenciatura em Matemática: LEANDRO ANTUNES, Matrícula SIAPE n° 2355888, como titular e MÁRCIA REGINA PIOVESAN, Matrícula SIAPE n° 1756757, como suplente; k) Representante da Coordenação do Curso de Tecnologia em Processos Químicos: CAMILA VARGAS NEVES, Matrícula SIAPE n° 1280305, como titular e MICHELLE MARIA DETONI ZANETTE, Matrícula SIAPE n° 1839873, como suplente; l) Representante da Coordenação do Curso de Tecnologia em Sistemas para Internet: ROSANE FÁTIMA PASSARINI, Matrícula SIAPE n° 2342043, como titular e FÁBIO ENGEL DE CAMARGO, Matrícula SIAPE n° 2151355, como suplente; m) Representante do Núcleo de Ciências Humanas, letras e Sociais Aplicadas: DAIANE DA SILVA LOURENÇO, Matrícula SIAPE n° 2049542, como titular e DIANE APARECIDA OSTROSKI, Matrícula SIAPE n° 1765158, como suplente; n) Representante do Núcleo de Física: LEONARDO DE LIMA, Matrícula SIAPE n° 1420312, como titular e DANUCE MARCELE DUDEK, Matrícula SIAPE n° 1320810, como suplente; o) Representante dos Programas de Pós-Graduação S tricto Sensu do Campus Toledo: RICARDO FIORI ZARA, Matrícula SIAPE n° 2527702, como titular e ROSANGELA APARECIDA BOTINHA ASSUMPÇÃO, Matrícula SIAPE n° 2884339, como suplente; p) Representante dos Técnico-Administrativos em Educação: DANIELLE CAMARGO, Matrícula SIAPE n° 2155765, como titular e RAFAEL DAVIS, Matrícula SIAPE nº 1558891, como suplente; CARLA RECH RIBEIRO, Matrícula SIAPE n° 1964872, como titular e SIMONE URNAU, Matrícula SIAPE n° 1190240, como suplente; JORGE OTTA JUNIOR, Matrícula SIAPE n° 2044407, como titular e\n\nArt. 1º A deflagração do processo de escolha de Diretores(as)-Gerais de campus e a organização das respectivas listas tríplices para posterior nomeação pelo Reitor são atribuições do Conselho Universitário, consoante disposto no(s):\n\nArt. 1º A deflagração do processo de escolha de Diretores (as)-Gerais de Câmpus e a organização das respectivas listas tríplices para posterior nomeação pelo Reitor são atribuições do Conselho Universitário, consoante disposto no(s):\n\n(exceto orientador e coorientador). 1,5 III.4.14 Membro de banca de concurso público para provimento de cargo de Professor efetivo. 5 III.4.15 Presidência de Associação Científica de abrangência nacional ou internacional. 1,5 III.4.16 Membro de diretoria (exceto Presidência) de Associação Científica de abrangência nacional ou internacional. 1 III.4.17 Membro de banca de concurso público para provimento de cargo de Professor Substituto. 2 III.4.18 Membro de Comissão designada pelo MEC para avaliação das condições de criação, credenciamento e recredenciamento de cursos. 3 III.4.19 Membro de Comissão designada pelo MEC para avaliação institucional 3 III.4.20 Membro de Banca (exceto orientador e coorientador) de Avaliação de Estágio ou de trabalho de final de curso de graduação ou de especialização (não remunerado). 1 III.4.21 Implementação ou execução de projeto didático-pedagógico no curso técnico, na graduação e na pós-graduação stricto sensu para melhoria e desenvolvimento de curso. 3 III.4.22 Consultoria para Organismos Internacionais reconhecidos(UNESCO, ONU, FAO, IEEE, IEE, e similares). Pontuação por consultoria. 2\n\nArt. 3º – O Conselho de Graduação e Educação Profissional será constituído por um presidente e por conselheiros, obedecida a seguinte composição: § 1º – Os representantes docentes e técnicos administrativos eleitos terão mandato de quatro anos e os representantes discentes terão mandato de um ano. § 2º – Todos os membros eleitos poderão ser reconduzidos uma única vez ao cargo. § 3º – O mandato dos membros natos coincide com o exercício de sua função na UTFPR. § 4º – Os membros natos serão aqueles que estejam ocupando as funções definidas nos itens de II a IV no caput desse artigo Seção II\n---\nPergunta: Quais são as atribuições do Presidente do Colegiado de Curso?\nResposta: Art. 13 - Na iminência do encerramento do período de qualificação e destinação, conforme previdido no item VI do Regulamento Orgânico do Concelho Superior Acadêmico, devendo ser realizados pela União acadêmica todos os trabalhos necessários relativos aos estudantes, professores e demais colaboradores, bem como todo o restabelecimento acionado pelas autoridades universitárias.\n\n* * *\n\nPergunta: As responsabiliza-as do Mandatário?\nResposta: Arts. 11 e 12 – Omandatario deve manter-se fiel às suas obrigaçõess — cumprir seus devers, dar conta das suas obrigações e respeitar todas as normas aplicáveis. Além disto, tendo sido afastado pelos integrantes deste grupo disciplinar, apesar dele estar assentado sobre o direito constituintiivodistinto, ainda se encontra presunto de conduta civilmente inimogável, sem qualquer possibilidade de retratação, nem mesmo quanto a existencia plenamente legal de seu falcócio, suceder que tenham havia sido suscitadas contra ele diversas denuncias e reclamações públicas, mas também ainda mais prejudicadamente, talvez até perdurar essencialmente ativa, quando alhures emplacada fora do quadro jurídico desta uniãdeira organizaçônalidade, tão logo tivessem havia tomado conhecênciemade parte de cada membro do colegiado superintendente do controle superior, sobretudo em relação ao mandatório executado num único e indiviso momento, enquanto assim estavam subordinandossobrietotalmenteenumerouslyunanimoussubordinationedlysubservinglysuperordinatefullyfollowinglyfollowingsteadilystickingfastfirmallyfurtherforwardwardsuntilthenforthertogetherwithallofthem together with all the members present and participating duly or improperly so called unconstitutionally illegaly illegally illegalillegally unlawfalliblywrongfully wrongfully wrongly that is to say they are guilty of having contravened an obligation which formed part of their duties by reason of any one or more of the following acts:\n\n### #### [Disregare]\n\n#### Disregard it!\n\n— You have failed to heed your own advice! — Your attention has been directed towards nothing but this very same thing you were trying to avoid!",
    "contexts": [
      "I. designar os servidores abaixo relacionados, para compor o CONSELHO DE CAMPUS , do Campus Toledo da UTFPR, para o biênio 2025/2027: a) Direção-Geral: ELDER ELISANDRO SCHEMBERGER, Matrícula SIAPE n° 2114469, como titular e presidente, IVAN JOSÉ COSER, Matrícula SIAPE n° 1559136, como suplente; b) Diretoria de Graduação e Educação Profissional: IVAN JOSÉ COSER, Matrícula SIAPE n° 1559136, como titular e FELIPE WALTER DAFICO PFRIMER, Matrícula SIAPE n° 2012462, como suplente; c) Diretoria de Pesquisa e Pós-Graduação: MARIANA SBARAINI CORDEIRO, Matrícula SIAPE n° 1992458, como titular e EVANDRO ANDRE KONOPATZKI Matrícula SIAPE n° 1988861, como suplente; d) Diretoria de Planejamento e Administração: RODRIGO JOSÉ KIRSTEN, Matrícula SIAPE n° 1634763, como titular e LIS KARINA CARDOSO LUPATINI, Matrícula SIAPE n° 1946814, como suplente; e) Diretoria de Relações Empresariais e Comunitárias: SIDGLEY CAMARGO DE ANDRADE, Matrícula SIAPE n° 2579104, como titular e SUZAN KELLY BORGES PIOVESAN, Matrícula SIAPE n° 2336148, como suplente; f) Representante da Coordenação do Curso de Engenharia Civil: GUSTAVO SAVARIS, Matrícula SIAPE n° 1973112, como titular e GUILHERME ALAN SOUZA COSTA, Matrícula SIAPE n° 2222501, como suplente; g) Representante da Coordenação do Curso de Engenharia de Computação: MAURICIO ZARDO OLIVEIRA, Matrícula SIAPE n° 1426505, como titular e ALEXANDRE AUGUSTO GIRON , Matrícula SIAPE n° 2240358, como suplente; h) Representante da Coordenação do Curso de Engenharia de Bioprocessos e Biotecnologia: THIAGO CINTRA MANIGLIA, Matrícula SIAPE n° 2920808, como titular e KARINA GRAZIELLA FIAMETTI COLOMBO, Matrícula SIAPE n° 2941999, como suplente; i) Representante da Coordenação do Curso de Engenharia Eletrônica: JOSÉ DOLORES VERGARA DIETRICH, Matrícula SIAPE n° 1737729, como titular e FELIPE WALTER DAFICO PFRIMER, Matrícula SIAPE n° 2012462, como suplente; j) Representante da Coordenação do Curso de Licenciatura em Matemática: LEANDRO ANTUNES, Matrícula SIAPE n° 2355888, como titular e MÁRCIA REGINA PIOVESAN, Matrícula SIAPE n° 1756757, como suplente; k) Representante da Coordenação do Curso de Tecnologia em Processos Químicos: CAMILA VARGAS NEVES, Matrícula SIAPE n° 1280305, como titular e MICHELLE MARIA DETONI ZANETTE, Matrícula SIAPE n° 1839873, como suplente; l) Representante da Coordenação do Curso de Tecnologia em Sistemas para Internet: ROSANE FÁTIMA PASSARINI, Matrícula SIAPE n° 2342043, como titular e FÁBIO ENGEL DE CAMARGO, Matrícula SIAPE n° 2151355, como suplente; m) Representante do Núcleo de Ciências Humanas, letras e Sociais Aplicadas: DAIANE DA SILVA LOURENÇO, Matrícula SIAPE n° 2049542, como titular e DIANE APARECIDA OSTROSKI, Matrícula SIAPE n° 1765158, como suplente; n) Representante do Núcleo de Física: LEONARDO DE LIMA, Matrícula SIAPE n° 1420312, como titular e DANUCE MARCELE DUDEK, Matrícula SIAPE n° 1320810, como suplente; o) Representante dos Programas de Pós-Graduação S tricto Sensu do Campus Toledo: RICARDO FIORI ZARA, Matrícula SIAPE n° 2527702, como titular e ROSANGELA APARECIDA BOTINHA ASSUMPÇÃO, Matrícula SIAPE n° 2884339, como suplente; p) Representante dos Técnico-Administrativos em Educação: DANIELLE CAMARGO, Matrícula SIAPE n° 2155765, como titular e RAFAEL DAVIS, Matrícula SIAPE nº 1558891, como suplente; CARLA RECH RIBEIRO, Matrícula SIAPE n° 1964872, como titular e SIMONE URNAU, Matrícula SIAPE n° 1190240, como suplente; JORGE OTTA JUNIOR, Matrícula SIAPE n° 2044407, como titular e",
      "Art. 1º A deflagração do processo de escolha de Diretores(as)-Gerais de campus e a organização das respectivas listas tríplices para posterior nomeação pelo Reitor são atribuições do Conselho Universitário, consoante disposto no(s):",
      "Art. 1º A deflagração do processo de escolha de Diretores (as)-Gerais de Câmpus e a organização das respectivas listas tríplices para posterior nomeação pelo Reitor são atribuições do Conselho Universitário, consoante disposto no(s):",
      "(exceto orientador e coorientador). 1,5 III.4.14 Membro de banca de concurso público para provimento de cargo de Professor efetivo. 5 III.4.15 Presidência de Associação Científica de abrangência nacional ou internacional. 1,5 III.4.16 Membro de diretoria (exceto Presidência) de Associação Científica de abrangência nacional ou internacional. 1 III.4.17 Membro de banca de concurso público para provimento de cargo de Professor Substituto. 2 III.4.18 Membro de Comissão designada pelo MEC para avaliação das condições de criação, credenciamento e recredenciamento de cursos. 3 III.4.19 Membro de Comissão designada pelo MEC para avaliação institucional 3 III.4.20 Membro de Banca (exceto orientador e coorientador) de Avaliação de Estágio ou de trabalho de final de curso de graduação ou de especialização (não remunerado). 1 III.4.21 Implementação ou execução de projeto didático-pedagógico no curso técnico, na graduação e na pós-graduação stricto sensu para melhoria e desenvolvimento de curso. 3 III.4.22 Consultoria para Organismos Internacionais reconhecidos(UNESCO, ONU, FAO, IEEE, IEE, e similares). Pontuação por consultoria. 2",
      "Art. 3º – O Conselho de Graduação e Educação Profissional será constituído por um presidente e por conselheiros, obedecida a seguinte composição: § 1º – Os representantes docentes e técnicos administrativos eleitos terão mandato de quatro anos e os representantes discentes terão mandato de um ano. § 2º – Todos os membros eleitos poderão ser reconduzidos uma única vez ao cargo. § 3º – O mandato dos membros natos coincide com o exercício de sua função na UTFPR. § 4º – Os membros natos serão aqueles que estejam ocupando as funções definidas nos itens de II a IV no caput desse artigo Seção II"
    ],
    "ground_truth": [
      "Convocar e presidir as reuniões, com direito a voto de qualidade (voto de desempate);",
      "Designar Secretário;",
      "Aprovar a ata das reuniões anteriores, homologando-as no Colegiado;",
      "Elaborar a pauta das reuniões, com assuntos de interesse do Curso ou encaminhados pelos membros do Colegiado ou docentes/servidores técnico-administrativos vinculados ao Curso;",
      "Distribuir os processos para a análise do Colegiado, nomeando seus relatores com antecedência mínima de 72 (setenta e duas) horas da reunião;",
      "Constituir Comissões;",
      "Baixar atos visando à organização interna;",
      "Dar posse aos membros do Colegiado e,",
      "Indicar comissão para a eleição."
    ],
    "metadata": {
      "embedding_model": "stsb-xlm-r-multilingual",
      "process_time": 37.434608936309814
    }
  }
]