[
  {
    "question": "Quais os dias e horarios da semana em que acontecem as aulas da disciplina Árvores e Grafos?",
    "answer": "Não mentiona-se no contexto, por isso não posso fornecer a resposta.",
    "contexts": [
      "O professor Roger Borges ministra a disciplina Métodos Alternativos Para A Síntese De Materiais (TAM88) para a turma PPGTA no formato Presencial.\nHorários:\n- Quarta-feira: t4 (15:50-16:40), t5 (16:40-17:30) - Sala J31A",
      "O professor Daniel Walker Tondo ministra a disciplina Quimica 3: Quimica Da Vida, Ambiente E Materiais (QUIM3) para a turma PROFQUI no formato Presencial.\nHorários:\n- Sexta-feira: t1 (13:00-13:50) - Sala I47",
      "O professor Carla Cristina Bem ministra a disciplina Tratamento De Águas Para Abastecimento 1 (EM57A) para a turma M71 no formato Presencial.\nHorários:\n- Quarta-feira: t1 (13:00-13:50), t2 (13:50-14:40), t3 (14:40-15:30) - Sala I21",
      "O professor Ana Paula Peron ministra a disciplina Tratamento De Resíduos Agroindustriais (TAM86) para a turma PPGTA no formato Presencial.\nHorários:\n- Quinta-feira: t2 (13:50-14:40), t3 (14:40-15:30) - Sala J31A",
      "O professor Osvaldo Valarini Junior ministra a disciplina Metodologia Da Pesquisa Científica (TAM04) para a turma PPGTA no formato Presencial.\nHorários:\n- Quarta-feira: m4 (10:20-11:10), m5 (11:10-12:00) - Sala J31A"
    ],
    "ground_truth": [
      "Quinta-feira: t3 (14:40-15:30), t4 (15:50-16:40) - Sala L18",
      "Terca-feira: t4 (15:50-16:40), t5 (16:40-17:30) - Sala L18"
    ],
    "metadata": {
      "embedding_model": "all-MiniLM-L6-v2",
      "process_time": 2.576990842819214
    }
  },
  {
    "question": "A disciplina Aspectos Formais Da Computacao acontece de manhã ou de tarde?",
    "answer": "Esta informação não está disponível no contexto, por isso não posso responder essa pergunta.",
    "contexts": [
      "O professor Evando Carlos Pizzini ministra a disciplina Aspectos Formais Da Computação (CC56E) para a turma CC6 no formato Presencial.\nHorários:\n- Segunda-feira: m4 (10:20-11:10), m5 (11:10-12:00) - Sala L15\n- Terca-feira: m1 (07:30-08:20) - Sala L15",
      "O professor Ricardo Sobjak ministra a disciplina Tópicos Avançados Em Computação (CC58D) para a turma CC8 no formato Presencial.\nHorários:\n- Quarta-feira: m1 (07:30-08:20), m2 (08:20-09:10), m3 (09:10-10:00) - Sala L16\n- Quinta-feira: m2 (08:20-09:10), m3 (09:10-10:00) - Sala L16",
      "O professor Samuel Bellido Rodrigues ministra a disciplina Conceitos E Aplicações De Propriedade Intelectual (PROFNIT01) para a turma PNIT no formato Presencial.\nHorários:\n- Sexta-feira: m4 (10:20-11:10) - Sala I48",
      "O professor Sandra Regina Da Silva Pinela ministra a disciplina Conceitos E Aplicações De Propriedade Intelectual (PROFNIT01) para a turma PNIT no formato Presencial.\nHorários:\n- Sexta-feira: m6 (12:00-13:00) - Sala I48",
      "O professor Peterson Diego Kunh ministra a disciplina Seminário De Projeto De Mestrado (PROFNIT20) para a turma PNIT no formato Presencial.\nHorários:\n- Sexta-feira: t5 (16:40-17:30) - Sala I48"
    ],
    "ground_truth": [
      "de manhã"
    ],
    "metadata": {
      "embedding_model": "all-MiniLM-L6-v2",
      "process_time": 2.640000820159912
    }
  },
  {
    "question": "Qual a turma e a sala da disciplina Teoria Da Computação?",
    "answer": "CC5, Sala L15",
    "contexts": [
      "O professor Evando Carlos Pizzini ministra a disciplina Teoria Da Computação (COM1025) para a turma CC5 no formato Presencial.\nHorários:\n- Quinta-feira: t1 (13:00-13:50), t2 (13:50-14:40) - Sala L15\n- Segunda-feira: t1 (13:00-13:50), t2 (13:50-14:40), t3 (14:40-15:30) - Sala L15"
    ],
    "ground_truth": [
      "Turma: CC5",
      "Sala: L15"
    ],
    "metadata": {
      "embedding_model": "all-MiniLM-L6-v2",
      "process_time": 1.0909857749938965
    }
  },
  {
    "question": "A qual departamento pertence o professor Aikes?",
    "answer": "O professor Aikes pertence ao departamento DACOM.",
    "contexts": [
      "O professor Jorge Aikes Junior pertence ao departamento DACOM e está ativo no período 2025/1.",
      "O professor Alan Gavioli pertence ao departamento DACOM e está ativo no período 2025/1.",
      "O professor Carlos Aparecido Fernandes pertence ao departamento DAMEC e está ativo no período 2025/1.",
      "O professor - EQUIPE LIMPEZA pertence ao departamento SEGEA e está ativo no período 2025/1.",
      "O professor - ENSINO MEDIO pertence ao departamento SEGEA e está ativo no período 2025/1."
    ],
    "ground_truth": [
      "DACOM"
    ],
    "metadata": {
      "embedding_model": "all-MiniLM-L6-v2",
      "process_time": 1.2530009746551514
    }
  },
  {
    "question": "A qual departamento pertence o professor Jorge Aikes Junior?",
    "answer": "DACOM",
    "contexts": [
      "O professor Jorge Aikes Junior pertence ao departamento DACOM e está ativo no período 2025/1.",
      "O professor Jorge Aikes Junior ministra a disciplina Sistemas Inteligentes Aplicados (CC57A) para a turma CC7 no formato Presencial.\nHorários:\n- Quinta-feira: t4 (15:50-16:40), t5 (16:40-17:30) - Sala L16\n- Terca-feira: t4 (15:50-16:40), t5 (16:40-17:30) - Sala L16",
      "O professor Jorge Aikes Junior ministra a disciplina Construção De Compiladores (CC57B) para a turma CC7 no formato Presencial.\nHorários:\n- Quinta-feira: t2 (13:50-14:40), t3 (14:40-15:30) - Sala L16\n- Terca-feira: t2 (13:50-14:40), t3 (14:40-15:30) - Sala L16",
      "O professor Jorge Aikes Junior ministra a disciplina Realidade Virtual (OP63F) para a turma CC8 no formato Presencial.\nHorários:\n- Segunda-feira: m4 (10:20-11:10), m5 (11:10-12:00) - Sala L16\n- Terca-feira: m2 (08:20-09:10), m3 (09:10-10:00) - Sala L16"
    ],
    "ground_truth": [
      "DACOM"
    ],
    "metadata": {
      "embedding_model": "all-MiniLM-L6-v2",
      "process_time": 1.460989236831665
    }
  },
  {
    "question": "Quais as disciplinas o professor Jorge Aikes Junior ministra?",
    "answer": "- CC57A\n- CC57B\n- OP63F",
    "contexts": [
      "O professor Jorge Aikes Junior pertence ao departamento DACOM e está ativo no período 2025/1.",
      "O professor Jorge Aikes Junior ministra a disciplina Sistemas Inteligentes Aplicados (CC57A) para a turma CC7 no formato Presencial.\nHorários:\n- Quinta-feira: t4 (15:50-16:40), t5 (16:40-17:30) - Sala L16\n- Terca-feira: t4 (15:50-16:40), t5 (16:40-17:30) - Sala L16",
      "O professor Jorge Aikes Junior ministra a disciplina Construção De Compiladores (CC57B) para a turma CC7 no formato Presencial.\nHorários:\n- Quinta-feira: t2 (13:50-14:40), t3 (14:40-15:30) - Sala L16\n- Terca-feira: t2 (13:50-14:40), t3 (14:40-15:30) - Sala L16",
      "O professor Jorge Aikes Junior ministra a disciplina Realidade Virtual (OP63F) para a turma CC8 no formato Presencial.\nHorários:\n- Segunda-feira: m4 (10:20-11:10), m5 (11:10-12:00) - Sala L16\n- Terca-feira: m2 (08:20-09:10), m3 (09:10-10:00) - Sala L16"
    ],
    "ground_truth": [
      "Construção De Compiladores",
      "Realidade Virtual",
      "Sistemas Inteligentes Aplicados"
    ],
    "metadata": {
      "embedding_model": "all-MiniLM-L6-v2",
      "process_time": 2.3360390663146973
    }
  },
  {
    "question": "Qual professor ministra a disciplina de Realidade Virtual?",
    "answer": "O professor Jorge Aikes Junior ministra a disciplina de Realidade Virtual.",
    "contexts": [
      "O professor Jorge Aikes Junior ministra a disciplina Realidade Virtual (OP63F) para a turma CC8 no formato Presencial.\nHorários:\n- Segunda-feira: m4 (10:20-11:10), m5 (11:10-12:00) - Sala L16\n- Terca-feira: m2 (08:20-09:10), m3 (09:10-10:00) - Sala L16",
      "O professor Henry Charles Albert D Naidoo Terroso De Mendonca Brandao ministra a disciplina Didáticas Das Ciências E Educação Química (QUI1026) para a turma LQ4 no formato Presencial.\nHorários:\n- Segunda-feira: n1 (18:40-19:30), n2 (19:30-20:20) - Sala I44",
      "O professor Silvana Mendonca Lopes Valentin ministra a disciplina Práticas Escolares Em Educação Especial E Inclusiva (HLA1016) para a turma LQ5 no formato Presencial.\nHorários:\n- Segunda-feira: n1 (18:40-19:30), n2 (19:30-20:20) - Sala I43",
      "O professor Ismael Laurindo Costa Junior ministra a disciplina Perspectivas Profissionais (QUI1007) para a turma BQ1 no formato Presencial.",
      "O professor Samuel Bellido Rodrigues ministra a disciplina Conceitos E Aplicações De Propriedade Intelectual (PROFNIT01) para a turma PNIT no formato Presencial.\nHorários:\n- Sexta-feira: m4 (10:20-11:10) - Sala I48"
    ],
    "ground_truth": [
      "Jorge Aikes Junior"
    ],
    "metadata": {
      "embedding_model": "all-MiniLM-L6-v2",
      "process_time": 2.135197877883911
    }
  }
]