[
  {
    "question": "Qual documento Regulamenta a oferta de cursos de graduação na modalidade de Educação a Distância (EaD) e a oferta de carga horária na modalidade de EaD nos cursos de graduação presenciais da Universidade Tecnológica Federal do Paraná.",
    "answer": "Art. 1º Aprovar o regulamento da oferta de cursos de graduação na modalidade de Educação a Distância (EaD) e a oferta de carga horária na modalidade de EaD nos cursos de graduação presenciais da UTFPR.",
    "contexts": [
      "Art. 1º Aprovar o regulamento da oferta de cursos de graduação na modalidade de Educação a Distância (EaD) e da oferta de carga horária na modalidade de EaD nos cursos de graduação presenciais da Universidade Tecnológica Federal do Paraná (UTFPR), conforme anexo I.",
      "Art. 1º Ficam instituídas, por meio da presente resolução, as regras para a oferta, organização e o desenvolvimento de cursos na modalidade de Educação a Distância (EaD) e a inserção de carga horária na modalidade de EaD nos cursos presenciais de graduação da UTFPR.",
      "PROCESSO SELETIVO DE REOPÇÃO DE CURSO DE GRADUAÇÃO (Retificado em 20/01/2025 - ajuste do cronograma) A Pró-Reitoria de Graduação e Educação Profissional (PROGRAD) da Universidade Tecnológica Federal do Paraná (UTFPR) faz saber aos interessados que estarão abertas, por meio deste Edital, as inscrições ao Processo Seletivo de Reopção de Curso de Graduação para o primeiro período letivo de 2025 .",
      "Art. 1º Esta Instrução Normativa estabelece as normas e as diretrizes para a operacionalização do Estágio Supervisionado Curricular Obrigatório no âmbito do Curso de Licenciatura em Informática, do Campus Francisco Beltrão da Universidade Tecnológica Federal do Paraná – UTFPR. Do local",
      "PRÓ-REITORIA DE PESQUISA E PÓS-GRADUAÇÃO EDITAL PROPPG 09/2024 PROGRAMA DE APOIO A MANUTENÇÃO DE LABORATÓRIOS MULTIUSUÁRIOS A Pró-Reitoria de Pesquisa e Pós-Graduação (PROPPG) da Universidade Tecnológica Federal do Paraná (UTFPR) torna público que, no período de 02 /07/2024 a 31/07/2024 , estarão abertas as inscrições para solicitação de recursos de manutenção para atender demandas dos Laboratórios Multiusuários (LabMult ou FabMult) da UTFPR."
    ],
    "ground_truth": [
      "A Resolução COGEP/UTFPR Nº 181, de 9 de agosto de 2022."
    ],
    "metadata": {
      "embedding_model": "distiluse-base-multilingual-cased-v2",
      "process_time": 5.471997976303101
    }
  },
  {
    "question": "Qual documento Regulamenta as atividades complementares (ACs) dos cursos de graduação?",
    "answer": "O RODP (Regulamento da Organização Didático-Pedagógica dos Cursos de Graduação da UTFPR).",
    "contexts": [
      "LEITURAS OBRIGATÓRIAS Legislações disponíveis em: http://portal.utfpr.edu.br/documentos/graduacao-e-educacao-profissional/prograd , dentre as quais destacamos: Regulamento da Organização Didático-Pedagógica dos Cursos de Graduação da UTFPR – RODP, disponível em https://sei.utfpr.edu.br/sei/publicacoes/controlador_publicacoes.php?acao=publicacao_visualizar&id_documento=1033898&id_orgao_publicacao=0 Calendário Acadêmico de 2023, disponível em: https://sei.utfpr.edu.br/sei/publicacoes/controlador_publicacoes.php?acao=publicacao_visualizar&id_documento=3400469&id_orgao_publicacao=0",
      "ATIVIDADES COMPLEMENTARES. Incluem-se documentos referentes ao planejamento das atividades internas e a definição das atividades externas, que complementam os cursos de graduação e que sejam autorizadas pela instituição de ensino. Enquanto vigora - Guarda Permanente",
      "PLANO DE ESTÁGIO. Incluem-se documentos referentes ao estabelecimento das atividades a serem realizadas pelos estudantes. Enquanto o estudante mantiver o vínculo com a administração pública 2 anos Eliminação",
      "ANÁLISE INICIAL A minuta se enquadra na definição de ato normativo? Veja item IDENTIFICAÇÃO DA NECESSIDADE DE NORMATIZAÇÃO (link para a página XX deste manual). A autoridade emissora do ato possui atribuição de competência formal? Veja item VERIFICAÇÃO DE COMPETÊNCIA (link para a página XX deste manual). Foi verificado se existe ato normativo superior que já normatiza sobre o tema? (se há uma normativa superior que disciplina o tema, somente será necessário fazer nova normativa se aquela precisar de complementação ou detalhamento) A normativa está unificando todas as normas anteriores sobre o tema no âmbito a que se propõe e revogando as que não estarão mais em vigor?",
      "MODELO DE DECLARAÇÃO DO COORDENADOR DO CURSO - Projeto com proposta de criação de disciplina extensionista - A Coordenação do Curso.........................................declara que o projeto................................................coordenado pelo(a) professor(a)........................................................está vinculado à disciplina extensionista ....................................................prevista no PPC / será vinculado à disciplina extensionista................................................., que está prevista no PPC , oferecendo oportunidades para os(as) alunos(as) participarem da equipe executora do projeto visando a creditação da extensão. Colocamo-nos à disposição para esclarecimentos que se fizerem necessários. Nome do Coordenador do Curso Coordenador do Curso de xxxxxxxxxxxxxxxxx"
    ],
    "ground_truth": [
      "A Resolução COGEP/UTFPR Nº 179, de 4 de agosto de 2022."
    ],
    "metadata": {
      "embedding_model": "distiluse-base-multilingual-cased-v2",
      "process_time": 4.147000551223755
    }
  },
  {
    "question": "O que resolve a Resolução COGEP/UTFPR Nº 167, de 24 de junho de 2022?",
    "answer": "Não há informação na resolução sobre essa questão.",
    "contexts": [
      "Art. 3º Ficam revogadas a Resolução nº 61/06 – COEPP , de 01 de setembro de 2006, retificada pela Resolução nº 56/07 – COEPP , de 22 de junho de 2007 e pela Resolução COGEP/UTFPR nº 65/2021 , de 01 de abril de 2021, publicada no Boletim de Serviço Eletrônico em 06/04/2021; e a Resolução COGEP/UTFPR nº 158, de 11 de maio de 2022 , publicada no Boletim de Serviço Eletrônico em 12/05/2022.",
      "VII. CRONOGRAMA DE EXECUÇÃO DO CURSO (PREVISÃO) a. Início das atividades letivas: 06 de maio de 2022; b. Férias: em julho de 2022; c. Retomada: em 05 de agosto de 2022; d. Férias: em janeiro de 2023; e. Retomada: em 03 de fevereiro de 2023; f. Férias: em julho de 2023; g. Retomada: em 04 de agosto de 2023; h. Encerramento das atividades letivas: dezembro de 2023.",
      "Art. 2º Revogar a Resolução nº 90/2018 - COGEP, de 03 de dezembro de 2018 e retificada em 25 de abril de 2019 (SEI nº 0590328 e SEI nº 0797224 ) e a Resolução COGEP/UTFPR nº 85/2021, de 14 de julho de 2021 (SEI nº 2141324 ).",
      "CRONOGRAMA 6.1 Abertura do Convite PROPPG 05/2021 20/03/2023 6.2 Período de Inscrição (SEI/DEICT) 20/março a 24/abril de 2023 6.3 Divulgação do Resultado Preliminar 26/abril de 2023 6.4 Interposição de recursos 26 a 28/abril de 2023 6.5 Resultado Final 03/maio de 2023",
      "DIRETORIA DE PESQUISA E PÓS-GRADUAÇÃO - CAMPUS PATO BRANCO DEPARTAMENTO DE APOIO DOS CURSOS DE ESPECIALIZAÇÃO LATO-SENSU DO CAMPUS PATO BRANCO EDITAL Nº 02/2023 - DIRPPG-PB - CURSO DE ESPECIALIZAÇÃO EM GESTÃO CONTÁBIL E FINANCEIRA"
    ],
    "ground_truth": [
      "Aprova a proposta de creditação curricular das atividades acadêmicas de extensão (AAEs) nos cursos de graduação da Universidade Tecnológica Federal do Paraná - UTFPR"
    ],
    "metadata": {
      "embedding_model": "distiluse-base-multilingual-cased-v2",
      "process_time": 3.0810017585754395
    }
  },
  {
    "question": "O que resolve a Resolução nº 36/2020 - COGEP?",
    "answer": "A resolução nº 36/2020 - COGEP define o prazo inicial de 8 weeks, após a conclusão do primeiro ciclo de provas, para a escolha de bolsistas.",
    "contexts": [
      "CONSELHO DE GRADUAÇÃO E EDUCAÇÃO PROFISSIONAL (Secretaria) Curitiba, 03 de dezembro de 2020. Resolução nº 47/2020 - COGEP RESOLUÇÃO Nº 47, DE 03 DE DEZEMBRO DE 2020 Trata da finalização do semestre 2020/1 . O CONSELHO DE GRADUAÇÃO E EDUCAÇÃO PROFISSIONAL DA UNIVERSIDADE TECNOLÓGICA FEDERAL DO PARANÁ , no uso das atribuições que lhe conferem,",
      "APÊNDICE A EDITAL 03 / 2023 – SELEÇÃO DE BOLSISTA NÍVEL MÉDIO PARA O LABORATÓRIO MULTIUSUÁRIO DE FOTÔNICA Formulário de inscrição I - Identificação: Nome: _________________________________________________________ Idade: __________________________________________________________ Curso de graduação que está cursando: _______________________________ Período: _____________________________ CR: _______________________ II - Atividades a serem desenvolvidas: As atividades relacionadas à bolsa-técnico do Laboratório Multiusuário de Fotônica estão abaixo indicadas: Acompanhar operação dos instrumentos, preparo de amostras e realização de medidas com alunos ; Elaboração e revisão de documentos tais como formulários, modelos de relatórios, procedimentos, entre outros; Elaboração de levantamentos em planilhas e realização de orçamentos. III - Motivação: Descreva, em linhas gerais, quais são suas principais aptidões e motivações para ocupar a vaga de bolsista a qual se refere esse processo de seleção: ____________________________________________________________________ ____________________________________________________________________ ____________________________________________________________________ ( máximo 10 linhas ) Local e Data: Nome e assinatura do candidato:",
      "ANÁLISE INICIAL A minuta se enquadra na definição de ato normativo? Veja item IDENTIFICAÇÃO DA NECESSIDADE DE NORMATIZAÇÃO (link para a página XX deste manual). A autoridade emissora do ato possui atribuição de competência formal? Veja item VERIFICAÇÃO DE COMPETÊNCIA (link para a página XX deste manual). Foi verificado se existe ato normativo superior que já normatiza sobre o tema? (se há uma normativa superior que disciplina o tema, somente será necessário fazer nova normativa se aquela precisar de complementação ou detalhamento) A normativa está unificando todas as normas anteriores sobre o tema no âmbito a que se propõe e revogando as que não estarão mais em vigor?",
      "DECLARAÇÃO DE CIÊNCIA DO BOLSISTA EDITAL UTFPR-OESTE Nº 01/2023 - NAPI OESTE SELEÇÃO DE BOLSISTAS DE INICIAÇÃO TECNOLÓGICA Eu, __________________________________________________, comprometo-me, se contemplado(a), a dedicar 20 (vinte) horas semanais ao Projeto: “Governança Interinstitucional para Promoção de Pesquisa Aplicada e Inovação no Território do Oeste do Paraná - Brasil”, temática “Inovação e Conectividade”, “NAPI Oeste”, a não usufruir de qualquer outra modalidade de bolsa e não ter vínculo empregatício, durante o período de vigência da bolsa pleiteada, cumprir o cronograma de atividades e entregar os relatórios exigidos, bem como informar qualquer alteração que surgir na sua condição de bolsista. Estou ciente e de acordo que como bolsista não terei direito a benefícios sociais, como férias, fundo de garantia, contribuição previdenciária ou qualquer outro benefício. Declaro ainda que estou ciente de que o não cumprimento deste termo implica no cancelamento da bolsa concedida. _____________________, _____ de ________________ de 2023. __________________________ Assinatura do Bolsista",
      "DECLARAÇÃO DE CIÊNCIA DO BOLSISTA EDITAL UTFPR-OESTE Nº 01/2022 - NAPI OESTE SELEÇÃO DE BOLSISTAS DE INICIAÇÃO TECNOLÓGICA Eu, __________________________________________________, comprometo-me, se contemplado(a), a dedicar 20 (vinte) horas semanais ao Projeto: “Governança Interinstitucional para Promoção de Pesquisa Aplicada e Inovação no Território do Oeste do Paraná - Brasil”, temática “Inovação e Conectividade”, “NAPI Oeste”, a não usufruir de qualquer outra modalidade de bolsa e não ter vínculo empregatício, durante o período de vigência da bolsa pleiteada, cumprir o cronograma de atividades e entregar os relatórios exigidos, bem como informar qualquer alteração que surgir na sua condição de bolsista. Estou ciente e de acordo que como bolsista não terei direito a benefícios sociais, como férias, fundo de garantia, contribuição previdenciária ou qualquer outro benefício. Declaro ainda que estou ciente de que o não cumprimento deste termo implica no cancelamento da bolsa concedida. _____________________, _____ de ________________ de 2022. __________________________ Assinatura do Bolsista"
    ],
    "ground_truth": [
      "Aprova o Regulamento para Concessão do Auxílio Estudantil Emergencial para Estudantes Matriculados nos Cursos Regulares da UTFPR"
    ],
    "metadata": {
      "embedding_model": "distiluse-base-multilingual-cased-v2",
      "process_time": 6.100999355316162
    }
  },
  {
    "question": "Quais são as atribuições do Presidente do Colegiado de Curso?",
    "answer": "Esta informação não está presente na contextação, portanto, posso concluir que essa pergunta não tem resposta possível.",
    "contexts": [
      "FORMULÁRIO DE AVALIAÇÃO DO CANDIDATO(A) Nome candidato(a): _________________________________________________________ Programa de Pós-Graduação ou Curso de Graduação:________________________________________________________________ Orientador(a): ______________________________________________________________ Excelente Bom Regular Não satisfatório Conhecimento técnico na área Interesse no tema proposto Participação em Projeto de Pesquisa Demonstração de interesse Capacidade de expressão oral Excelente: 4; Bom: 3; Regular 2; Insatisfatório 1. Outras observações: ________________________________________________________ _________________________________________________________________________ _________________________________________________________________________ Local e data: Assinatura do Orientador",
      "FORMULÁRIO PARA SUBSTITUIÇÃO DE ESTUDANTE BOLSISTA Solicito a substituição do(a) estudante(a): ____________________________________________________________________ Vinculado ao projeto intitulado: ___________________________________________________________________________ Pelo(a) estudante: _______________________________________________________________________________________ Justificativa: ______________________________________________________________________________________________________ ______________________________________________________________________________________________________ Estudante era voluntário(a): Sim ( ) Não ( ) Nome do/a requerente: _______________________________ Assinatura: Assinatura do(a) estudante substituído(a): Assinatura do(a) estudante substituto(a): Local e data:________________________________________________________________ Aval do NUAPE: Local e data:_____________________________________________ Nome:_____________________________________ Assinatura:",
      "APÊNDICE B – INDICADORES DE PRODUTIVIDADE DE LABORATÓRIO MULTIUSUÁRIO Eu, ________________________________, CPF: _________________________, servidor(a) da UTFPR, do campus __________, Supervisor do Laboratório Multiusuário (LabMult) da UTFPR denominado _________________________ ( sigla ), homologado institucionalmente pelo Comitê de Laboratórios Multiusuários da instituição, DECLARO que estou ciente e concordo com os termos do Edital PROPPG 09/2024 e das responsabilidades pelas informações aqui declaradas. Quadro C. Indicadores de Produtividade do Laboratório Multiusuário Indicador Critério de pontuação* Declaração do Proponente I.1 Registro de utilização de seus serviços. *Colocar o número de horas utilizadas por equipamento Considerar apenas equipamentos analíticos, não inserir horas de uso de equipamentos como ar condicionado, geladeira, ou outros não utilizados diretamente na realização da análise. I.2 Quantidade de Programas de Pós Graduação (PPG) que utilizaram o laboratório em 2023. Declaração do orientador ou coordenação dos respectivos PPG’s. I.3 a Quantidade de Grupos de Pesquisa Certificados que utilizaram o laboratório em 2023. Declaração do líder do grupo ou print da página “espelho do grupo” do CNPq. I.3 b Quantidade de NAPIs que utilizaram o laboratório em 2023. Declaração do líder ou comprovante de participação do pesquisador no referido NAPI (print da página do participante na plataforma iAraucária) ou print da página institucional. I.4 Quantidade de pesquisadores da UTFPR que usaram o laboratório em 2023 para a realização de Projetos de Pesquisa Científica e Tecnológica, Desenvolvimento tecnológico ou Inovação. Declaração do pesquisador interno. I.5 Quantidade de pesquisadores de outras instituições que usaram o laboratório em 2023. Declaração do pesquisador externo. I.6 Quantidade de usuários externos (pessoas físicas ou jurídicas) que usaram o serviço do laboratório em 2023. Nota fiscal do serviço prestado ou declaração do usuário indicando os serviços realizadas pelo LabMult. I.7 a Montante arrecadado com prestação de serviços e/ou consultorias em 2023. Extrato da FUNTEF contendo os valores arrecadados e/ou extrato da execução da consultoria com comprovantes de utilização dos recursos para o LabMult. I.7 b Montante arrecadado por meio de contrapartida institucional (Tesouro, PROAP, Edital PAPCDT, etc) Declaração do Setor ou Servidor onde conste o valor da contrapartida. I.8 a Quantidade de Projetos de alunos de graduação: Iniciação Científica ou Tecnológica, Extensão, TCCs, etc, desenvolvidos com o apoio do laboratório em 2023. Declaração do orientador do Projeto. I.8 c Quantidade de Projetos de alunos de pós-graduação: Mestrado, Doutorado e Projetos de Pós-Doutoramento desenvolvidos com o apoio do laboratório em 2023. Declaração do orientador do Projeto. I.8 d Projetos ou acordos de Cooperação Técnica (em andamento ou concluídas) desenvolvidas com o apoio do laboratório em 2023. Declaração da DIREC do campus. I.9 a Quantidade de produções científicas do tipo TCC publicadas em 2023. Apresentar o link institucional onde está disponibilizada a publicação. *Devem ser indicados apenas trabalhos onde o Laboratório é referenciado (ex: nos agradecimentos ou na metodologia indicando os equipamentos utilizados, etc) I.9 b Quantidade de produções científicas do tipo dissertação de mestrado acadêmico ou profissional publicadas em 2023. I.9 c Quantidade de produções científicas do tipo tese de doutoramento publicadas em 2023. I.9 d Quantidade de produções científicas com",
      "MODELO DE DECLARAÇÃO DO COORDENADOR DO CURSO - Projeto com proposta de criação de disciplina extensionista - A Coordenação do Curso.........................................declara que o projeto................................................coordenado pelo(a) professor(a)........................................................está vinculado à disciplina extensionista ....................................................prevista no PPC / será vinculado à disciplina extensionista................................................., que está prevista no PPC , oferecendo oportunidades para os(as) alunos(as) participarem da equipe executora do projeto visando a creditação da extensão. Colocamo-nos à disposição para esclarecimentos que se fizerem necessários. Nome do Coordenador do Curso Coordenador do Curso de xxxxxxxxxxxxxxxxx",
      "TERMO DE COMPROMISSO Declaro, para os devidos fins, que eu, ______________________________________________, nº do CPF ________________, aluno(a) devidamente matriculado(a) no Programa de Pós-Graduação/Curso de Graduação ________________________________________________ sob o registro acadêmico ________________________, em nível de _____________ (graduação, mestrado ou doutorado), da Universidade Tecnológica Federal do Paraná, tenho ciência das obrigações inerentes à qualidade de bolsista na modalidade de mestrado ou doutorado, e nesse sentido, COMPROMETO-ME a respeitar as seguintes cláusulas: Dedicação integral às atividades acadêmicas e de pesquisa do Programa de Pós-graduação; Comprovar desempenho acadêmico satisfatório, consoante as normas definidas pelo Programa de Pós-graduação ou Curso de Graduação; Não possuir qualquer relação de trabalho com a instituição promotora do Programa de Pós-Graduação ou Curso de Graduação; Não ser aposentado; Não acumular a recepção da bolsa com quaisquer agências nacionais, estrangeiras ou internacionais de fomento ao ensino e à pesquisa ou congêneres; Não receber remuneração proveniente de vínculo empregatício ou funcional, concomitante com a bolsa de graduação, mestrado ou doutorado; Ter currículo cadastrado e atualizado na Plataforma Lattes; Apresentar relatório técnico-científico anualmente, bem como o relatório técnico-científico final, de sua autoria, para a Pró-Reitoria de Pós-Graduação e Pesquisa com os resultados obtidos no desenvolvimento do Plano de Trabalho vinculado à sua bolsa; Participar de seminários de acompanhamento do Programa MAI/DAI realizados pela UTFPR; Participar de reuniões relativas ao Programa MAI/DAI, quando solicitado; Fazer referência à sua condição de estudante associado ao Programa de Mestrado e Doutorado Acadêmico de Inovação nas publicações e trabalhos apresentados, incluindo obrigatoriamente menção de agradecimento ao apoio da UTFPR, do MCTIC, do CNPq e da Empresa Parceira. O agradecimento ao apoio da Empresa Parceira deve ser autorizado pela mesma. Estar ciente e de acordo com o estabelecido nas normas gerais e específicas para as modalidades de bolsas graduação (ITI), mestrado (GM) e doutorado (GD) do CNPq. Ressarcir o CNPq ou a UTFPR quanto aos recursos pagos em seu proveito, atualizados pelo valor da mensalidade vigente no mês da devolução, no caso de abandono ou desistência de própria iniciativa, sem motivo de força maior, ou pelo não cumprimento das disposições normativas, conforme previsto em normas do CNPq. Assinatura do(a) bolsista: ______________________________ Local e data: ________________________________________ Coordenador(a) do Programa de Pós-Graduação _______________________________________ Nome e assinatura Orientador ________________________________________ Nome e assinatura"
    ],
    "ground_truth": [
      "Convocar e presidir as reuniões, com direito a voto de qualidade (voto de desempate);",
      "Designar Secretário;",
      "Aprovar a ata das reuniões anteriores, homologando-as no Colegiado;",
      "Elaborar a pauta das reuniões, com assuntos de interesse do Curso ou encaminhados pelos membros do Colegiado ou docentes/servidores técnico-administrativos vinculados ao Curso;",
      "Distribuir os processos para a análise do Colegiado, nomeando seus relatores com antecedência mínima de 72 (setenta e duas) horas da reunião;",
      "Constituir Comissões;",
      "Baixar atos visando à organização interna;",
      "Dar posse aos membros do Colegiado e,",
      "Indicar comissão para a eleição."
    ],
    "metadata": {
      "embedding_model": "distiluse-base-multilingual-cased-v2",
      "process_time": 8.571004152297974
    }
  }
]